appointmentId,startDateAndTime,endDateAndTime,remarks,status
713,2018-09-01 09:50:06,2018-09-01 15:47:11,posuere metus vitae ipsum aliquam non mauris,cancelled
714,2018-12-06 13:38:47,2018-12-06 08:49:44,felis donec semper sapien a libero nam dui proin leo odio porttitor,set
715,2018-11-27 02:29:03,2018-11-27 16:16:56,in congue etiam justo etiam pretium iaculis justo,set
716,2019-07-11 18:27:04,2019-07-11 02:16:51,amet eleifend pede libero quis orci,cancelled
717,2020-08-26 21:26:21,2020-08-26 07:37:17,sollicitudin mi sit amet lobortis sapien sapien non mi integer ac,set
718,2019-10-21 00:06:11,2019-10-21 13:49:42,ullamcorper augue a suscipit nulla elit ac nulla,cancelled
719,2019-02-20 01:02:06,2019-02-20 03:11:37,nibh quisque id justo sit amet,set
720,2018-06-17 20:42:00,2018-06-17 11:45:47,consequat morbi a ipsum integer a,cancelled
721,2018-11-26 04:52:36,2018-11-26 07:07:49,volutpat sapien arcu sed augue aliquam erat volutpat in congue etiam,cancelled
722,2018-12-10 06:53:51,2018-12-10 01:14:14,nulla sed accumsan felis ut at dolor quis,set
723,2020-07-07 18:03:25,2020-07-07 20:43:49,mauris sit amet eros suspendisse accumsan tortor,set
724,2018-06-02 06:45:26,2018-06-02 04:31:40,ultrices libero non mattis pulvinar nulla pede ullamcorper augue a suscipit nulla,set
725,2019-06-16 11:23:04,2019-06-16 12:10:32,vel dapibus at diam nam tristique,cancelled
726,2018-09-17 07:27:45,2018-09-17 02:27:51,consequat metus sapien ut nunc vestibulum ante,cancelled
727,2020-07-04 14:29:58,2020-07-04 01:27:36,magna ac consequat metus sapien ut nunc vestibulum ante ipsum,cancelled
728,2019-06-08 20:17:05,2019-06-08 20:51:33,at velit eu est congue elementum in hac habitasse platea,cancelled
729,2019-02-14 06:34:51,2019-02-14 15:10:43,sit amet diam in magna bibendum imperdiet nullam orci pede venenatis non,set
730,2019-02-17 12:45:50,2019-02-17 18:08:33,lacus curabitur at ipsum ac tellus semper interdum mauris ullamcorper,set
731,2019-08-30 06:35:38,2019-08-30 01:24:34,nullam sit amet turpis elementum ligula vehicula consequat morbi,set
732,2019-10-13 09:07:02,2019-10-13 20:45:15,sit amet sem fusce consequat nulla,cancelled
733,2019-03-17 14:52:51,2019-03-17 00:43:53,blandit nam nulla integer pede justo lacinia,set
734,2020-01-06 20:04:00,2020-01-06 00:49:53,nascetur ridiculus mus vivamus vestibulum sagittis sapien cum sociis natoque penatibus,cancelled
735,2018-10-14 17:52:10,2018-10-14 08:09:15,lacinia aenean sit amet justo morbi ut odio cras mi,set
736,2020-03-29 10:13:27,2020-03-29 19:58:47,sem praesent id massa id nisl venenatis lacinia aenean sit amet justo,cancelled
737,2019-04-05 15:14:26,2019-04-05 10:17:07,sociis natoque penatibus et magnis dis parturient,cancelled
738,2018-12-27 12:08:37,2018-12-27 17:04:51,vel est donec odio justo sollicitudin ut,cancelled
739,2019-11-12 12:14:13,2019-11-12 14:27:42,libero rutrum ac lobortis vel dapibus at,cancelled
740,2018-06-09 03:29:28,2018-06-09 12:41:59,at ipsum ac tellus semper interdum mauris ullamcorper purus sit amet nulla,set
741,2020-06-22 22:23:07,2020-06-22 09:16:00,cubilia curae duis faucibus accumsan odio curabitur convallis duis,set
742,2019-08-22 09:27:27,2019-08-22 08:46:01,morbi ut odio cras mi pede malesuada in imperdiet,cancelled
743,2019-08-05 22:47:36,2019-08-05 20:18:44,enim blandit mi in porttitor pede justo eu massa donec dapibus duis,cancelled
744,2018-11-05 10:15:52,2018-11-05 14:29:47,luctus rutrum nulla tellus in sagittis dui vel nisl duis ac,set
745,2019-11-12 23:52:56,2019-11-12 15:48:27,morbi sem mauris laoreet ut rhoncus aliquet,set
746,2018-08-12 21:21:57,2018-08-12 00:01:41,eget nunc donec quis orci eget orci vehicula condimentum,set
747,2020-01-05 10:04:07,2020-01-05 05:40:27,diam cras pellentesque volutpat dui maecenas tristique est et tempus,cancelled
748,2018-09-26 22:17:43,2018-09-26 04:01:47,condimentum neque sapien placerat ante nulla justo aliquam quis,set
749,2020-01-29 00:33:35,2020-01-29 20:19:54,elit ac nulla sed vel enim sit amet nunc viverra,cancelled
750,2018-10-07 08:37:04,2018-10-07 11:09:56,ornare consequat lectus in est risus auctor sed tristique,cancelled
751,2019-03-16 04:13:02,2019-03-16 14:11:20,luctus et ultrices posuere cubilia curae nulla dapibus dolor vel,set
752,2019-09-03 04:01:20,2019-09-03 15:17:24,lectus vestibulum quam sapien varius ut blandit non interdum in,cancelled
753,2020-05-31 05:23:21,2020-05-31 18:27:49,non mi integer ac neque duis bibendum morbi non quam,set
754,2018-12-22 22:20:26,2018-12-22 11:05:23,quis lectus suspendisse potenti in eleifend quam,cancelled
755,2019-07-13 08:06:51,2019-07-13 20:07:23,tristique est et tempus semper est quam pharetra,cancelled
756,2020-03-27 11:21:36,2020-03-27 10:03:07,in tempor turpis nec euismod scelerisque,set
757,2019-03-20 20:01:43,2019-03-20 20:33:00,suscipit nulla elit ac nulla sed vel enim sit amet,cancelled
758,2018-05-16 17:57:50,2018-05-16 13:49:14,vestibulum sit amet cursus id turpis integer aliquet massa id lobortis,set
759,2018-08-25 23:23:09,2018-08-25 14:32:04,maecenas tristique est et tempus semper est quam pharetra magna,cancelled
760,2018-07-23 01:45:17,2018-07-23 13:40:34,turpis eget elit sodales scelerisque mauris sit amet eros suspendisse,set
761,2019-09-15 02:23:29,2019-09-15 21:10:18,posuere cubilia curae duis faucibus accumsan odio curabitur convallis,cancelled
762,2019-10-20 00:49:04,2019-10-20 08:13:29,erat vestibulum sed magna at nunc commodo placerat praesent blandit,cancelled
763,2020-09-09 16:06:00,2020-09-09 05:01:39,pede justo eu massa donec dapibus duis at velit eu,cancelled
764,2019-04-29 02:46:30,2019-04-29 20:46:34,eget orci vehicula condimentum curabitur in libero ut,cancelled
765,2018-11-13 02:03:23,2018-11-13 15:47:55,augue vestibulum ante ipsum primis in,cancelled
766,2020-02-28 20:32:19,2020-02-28 22:25:52,platea dictumst morbi vestibulum velit id pretium iaculis diam erat,cancelled
767,2019-05-02 11:49:05,2019-05-02 11:00:57,lacinia eget tincidunt eget tempus vel pede,cancelled
768,2018-09-05 20:03:47,2018-09-05 15:04:30,dapibus augue vel accumsan tellus nisi eu orci,cancelled
769,2020-01-23 08:38:59,2020-01-23 13:27:32,quis justo maecenas rhoncus aliquam lacus morbi quis tortor id nulla,cancelled
770,2019-03-07 16:30:48,2019-03-07 13:08:36,sapien quis libero nullam sit amet turpis elementum ligula vehicula,cancelled
771,2018-07-12 00:09:19,2018-07-12 09:11:55,justo etiam pretium iaculis justo in,set
772,2019-05-04 19:43:56,2019-05-04 17:32:51,suspendisse potenti nullam porttitor lacus at turpis donec posuere metus vitae ipsum,set
773,2019-04-15 07:47:26,2019-04-15 12:55:33,eget rutrum at lorem integer tincidunt ante vel ipsum praesent,set
774,2019-07-06 17:43:33,2019-07-06 08:56:45,duis ac nibh fusce lacus purus,set
775,2019-03-30 06:28:39,2019-03-30 22:00:14,ultrices phasellus id sapien in sapien iaculis congue vivamus,set
776,2020-03-19 08:46:37,2020-03-19 21:12:24,ac consequat metus sapien ut nunc vestibulum ante ipsum,cancelled
777,2020-04-17 00:14:12,2020-04-17 07:46:29,tristique est et tempus semper est quam pharetra,cancelled
778,2020-01-28 20:22:16,2020-01-28 03:47:18,diam vitae quam suspendisse potenti nullam porttitor lacus at turpis donec posuere,set
779,2018-08-11 07:01:16,2018-08-11 05:01:01,donec diam neque vestibulum eget vulputate ut ultrices,set
780,2020-06-17 23:49:21,2020-06-17 15:23:24,mi integer ac neque duis bibendum morbi non quam nec dui,set
781,2020-08-08 11:58:56,2020-08-08 13:52:00,tempus vivamus in felis eu sapien,cancelled
782,2019-06-18 09:53:12,2019-06-18 19:09:47,tristique est et tempus semper est quam pharetra magna ac,cancelled
783,2019-12-25 03:48:36,2019-12-25 22:28:18,lacus purus aliquet at feugiat non pretium quis lectus suspendisse potenti,cancelled
784,2019-12-01 10:07:22,2019-12-01 00:22:18,vestibulum aliquet ultrices erat tortor sollicitudin mi sit amet lobortis sapien sapien,set
785,2019-05-28 06:44:17,2019-05-28 16:33:00,pharetra magna ac consequat metus sapien ut,cancelled
786,2020-02-10 01:34:35,2020-02-10 09:01:04,blandit non interdum in ante vestibulum ante ipsum,set
787,2018-07-27 03:07:00,2018-07-27 01:57:52,sapien dignissim vestibulum vestibulum ante ipsum primis in faucibus orci luctus et,set
788,2020-01-06 05:17:41,2020-01-06 09:01:21,sed sagittis nam congue risus semper,set
789,2020-08-19 06:01:07,2020-08-19 23:17:18,nulla sed accumsan felis ut at dolor quis,cancelled
790,2018-10-26 10:20:35,2018-10-26 20:55:56,mattis egestas metus aenean fermentum donec ut mauris eget massa tempor convallis,set
791,2018-10-18 12:21:11,2018-10-18 11:22:40,lectus pellentesque at nulla suspendisse potenti cras in purus eu magna,set
792,2019-12-01 08:38:27,2019-12-01 18:53:57,metus aenean fermentum donec ut mauris eget massa tempor,cancelled
793,2020-09-07 06:21:54,2020-09-07 07:33:55,consequat ut nulla sed accumsan felis,cancelled
794,2020-06-18 11:43:42,2020-06-18 19:16:48,mauris laoreet ut rhoncus aliquet pulvinar sed nisl nunc rhoncus dui,set
795,2020-09-05 15:21:28,2020-09-05 02:01:25,nullam sit amet turpis elementum ligula vehicula consequat morbi a ipsum,set
796,2019-01-03 12:51:36,2019-01-03 11:58:00,id justo sit amet sapien dignissim vestibulum vestibulum ante ipsum primis,cancelled
797,2019-11-01 12:14:01,2019-11-01 23:32:53,quisque erat eros viverra eget congue eget semper rutrum nulla nunc,cancelled
798,2018-11-05 13:52:16,2018-11-05 03:11:39,cum sociis natoque penatibus et magnis,cancelled
799,2019-02-17 00:57:16,2019-02-17 02:19:43,platea dictumst aliquam augue quam sollicitudin,cancelled
800,2019-02-14 19:45:48,2019-02-14 02:53:58,volutpat eleifend donec ut dolor morbi vel,cancelled
801,2019-04-13 04:51:58,2019-04-13 13:57:39,at vulputate vitae nisl aenean lectus pellentesque eget,cancelled
802,2019-06-11 21:37:54,2019-06-11 02:27:58,est phasellus sit amet erat nulla tempus vivamus in,cancelled
803,2019-09-04 00:04:55,2019-09-04 20:39:10,ut ultrices vel augue vestibulum ante ipsum,cancelled
804,2018-09-21 19:53:48,2018-09-21 21:30:23,massa quis augue luctus tincidunt nulla mollis molestie,set
805,2018-06-04 22:05:19,2018-06-04 05:20:58,nisl nunc rhoncus dui vel sem sed sagittis nam,cancelled
806,2019-08-30 13:05:42,2019-08-30 23:41:35,massa tempor convallis nulla neque libero convallis eget eleifend luctus ultricies,cancelled
807,2020-06-30 00:13:17,2020-06-30 03:11:44,ut blandit non interdum in ante vestibulum ante,set
808,2018-11-26 19:20:38,2018-11-26 16:59:33,commodo placerat praesent blandit nam nulla integer pede justo lacinia eget tincidunt,set
809,2018-06-13 10:29:44,2018-06-13 00:02:52,justo sit amet sapien dignissim vestibulum vestibulum,cancelled
810,2018-11-18 12:31:13,2018-11-18 11:09:01,in eleifend quam a odio in hac habitasse platea dictumst,set
811,2019-11-17 09:49:13,2019-11-17 17:03:28,sapien cursus vestibulum proin eu mi nulla ac enim in,cancelled
812,2018-12-14 00:12:23,2018-12-14 03:14:03,iaculis congue vivamus metus arcu adipiscing molestie,cancelled
813,2019-09-28 23:46:52,2019-09-28 18:17:18,vestibulum proin eu mi nulla ac enim in tempor,set
814,2018-11-13 18:02:52,2018-11-13 05:07:15,congue elementum in hac habitasse platea dictumst morbi vestibulum velit id pretium,set
815,2018-11-17 13:07:30,2018-11-17 09:48:12,quam pede lobortis ligula sit amet eleifend pede libero quis orci nullam,set
816,2019-01-17 08:55:38,2019-01-17 00:48:19,pulvinar sed nisl nunc rhoncus dui vel sem sed sagittis nam,set
817,2020-08-07 10:11:42,2020-08-07 08:34:37,diam id ornare imperdiet sapien urna,set
818,2019-02-09 15:05:19,2019-02-09 18:33:22,ut massa quis augue luctus tincidunt nulla mollis molestie lorem,set
819,2019-09-28 12:47:53,2019-09-28 15:19:32,tincidunt nulla mollis molestie lorem quisque ut erat,cancelled
820,2020-05-05 04:22:40,2020-05-05 14:19:27,commodo vulputate justo in blandit ultrices enim,cancelled
821,2018-11-30 15:01:27,2018-11-30 13:06:39,rutrum nulla tellus in sagittis dui vel nisl duis,set
822,2018-09-04 18:08:47,2018-09-04 10:43:49,pulvinar sed nisl nunc rhoncus dui vel sem sed sagittis nam,cancelled
823,2020-07-16 23:01:44,2020-07-16 10:57:00,quam sollicitudin vitae consectetuer eget rutrum at,cancelled
824,2019-05-19 06:30:55,2019-05-19 05:14:33,turpis sed ante vivamus tortor duis,cancelled
825,2020-08-04 10:37:31,2020-08-04 10:28:30,varius nulla facilisi cras non velit nec,cancelled
826,2019-10-01 16:15:57,2019-10-01 00:50:24,habitasse platea dictumst morbi vestibulum velit,set
827,2019-11-14 23:33:50,2019-11-14 17:29:47,pede ullamcorper augue a suscipit nulla elit ac nulla sed vel enim,cancelled
828,2020-03-05 06:38:06,2020-03-05 18:33:13,in faucibus orci luctus et ultrices posuere cubilia curae mauris,cancelled
829,2019-01-23 12:28:20,2019-01-23 07:45:59,quisque erat eros viverra eget congue eget semper rutrum nulla,set
830,2019-01-06 23:44:49,2019-01-06 05:57:37,sem mauris laoreet ut rhoncus aliquet pulvinar sed nisl nunc rhoncus dui,set
831,2020-02-17 13:16:59,2020-02-17 02:12:14,bibendum imperdiet nullam orci pede venenatis non sodales sed tincidunt eu,set
832,2020-05-19 18:58:54,2020-05-19 14:47:46,sem sed sagittis nam congue risus semper porta,cancelled
833,2020-07-27 01:45:40,2020-07-27 09:09:32,augue vestibulum rutrum rutrum neque aenean,set
834,2020-03-20 21:21:57,2020-03-20 15:15:39,sed justo pellentesque viverra pede ac diam cras pellentesque volutpat dui maecenas,cancelled
835,2018-10-09 19:51:05,2018-10-09 10:19:22,quis odio consequat varius integer ac leo pellentesque ultrices mattis,set
836,2019-01-12 16:19:10,2019-01-12 20:52:48,platea dictumst aliquam augue quam sollicitudin vitae consectetuer eget rutrum at,set
837,2019-11-09 04:18:18,2019-11-09 11:19:22,porttitor id consequat in consequat ut nulla sed accumsan,cancelled
838,2019-05-12 02:10:56,2019-05-12 22:04:52,pellentesque ultrices phasellus id sapien in sapien iaculis congue vivamus metus,set
839,2020-08-17 10:48:09,2020-08-17 22:37:03,nec dui luctus rutrum nulla tellus in sagittis dui vel nisl duis,cancelled
840,2019-09-17 21:30:55,2019-09-17 16:45:36,enim blandit mi in porttitor pede justo eu massa,set
841,2018-12-09 17:28:25,2018-12-09 06:07:37,sapien cursus vestibulum proin eu mi nulla ac,set
842,2020-08-21 19:46:17,2020-08-21 14:29:30,et ultrices posuere cubilia curae duis,cancelled
843,2020-06-09 23:47:27,2020-06-09 11:36:57,ut suscipit a feugiat et eros vestibulum ac est lacinia nisi venenatis,set
844,2018-08-03 21:59:50,2018-08-03 21:16:30,justo aliquam quis turpis eget elit sodales scelerisque,set
845,2019-04-16 03:16:58,2019-04-16 02:47:09,a libero nam dui proin leo,set
846,2019-06-13 07:25:30,2019-06-13 10:23:52,enim sit amet nunc viverra dapibus nulla suscipit ligula in lacus curabitur,set
847,2020-01-17 04:11:56,2020-01-17 14:28:03,justo lacinia eget tincidunt eget tempus vel,set
848,2018-08-04 05:02:09,2018-08-04 05:51:52,vulputate ut ultrices vel augue vestibulum ante ipsum primis in faucibus orci,cancelled
849,2020-04-06 14:24:14,2020-04-06 18:00:27,venenatis lacinia aenean sit amet justo morbi ut odio,set
850,2018-07-04 08:34:55,2018-07-04 17:42:56,lorem vitae mattis nibh ligula nec,set
851,2019-02-10 03:23:34,2019-02-10 14:49:53,curae nulla dapibus dolor vel est donec odio justo,set
852,2018-12-19 09:33:46,2018-12-19 10:12:54,tempus vel pede morbi porttitor lorem id ligula,set
853,2019-03-01 01:27:54,2019-03-01 07:55:23,arcu adipiscing molestie hendrerit at vulputate vitae nisl aenean lectus pellentesque,set
854,2018-12-13 18:40:51,2018-12-13 20:50:14,interdum in ante vestibulum ante ipsum,cancelled
855,2019-12-25 10:33:34,2019-12-25 12:54:21,luctus et ultrices posuere cubilia curae,set
856,2020-09-07 12:10:45,2020-09-07 11:09:02,est congue elementum in hac habitasse,set
857,2019-11-27 22:19:26,2019-11-27 18:16:08,luctus tincidunt nulla mollis molestie lorem quisque ut erat curabitur gravida nisi,set
858,2019-12-01 06:50:12,2019-12-01 17:33:20,consectetuer adipiscing elit proin risus praesent lectus vestibulum,set
859,2019-05-21 04:43:42,2019-05-21 14:49:43,tortor duis mattis egestas metus aenean,cancelled
860,2019-08-16 17:24:06,2019-08-16 05:02:09,aliquam lacus morbi quis tortor id nulla ultrices aliquet,cancelled
861,2019-12-04 00:22:29,2019-12-04 20:51:11,pede malesuada in imperdiet et commodo,cancelled
862,2019-11-02 18:21:39,2019-11-02 22:24:58,aenean lectus pellentesque eget nunc donec quis orci,cancelled
863,2020-05-12 11:32:20,2020-05-12 03:10:56,aliquam erat volutpat in congue etiam justo etiam pretium iaculis justo,cancelled
864,2019-05-25 04:16:26,2019-05-25 22:49:12,curabitur convallis duis consequat dui nec nisi volutpat,cancelled
865,2019-09-14 06:51:14,2019-09-14 19:23:25,aliquet maecenas leo odio condimentum id luctus nec,set
866,2018-09-14 00:43:15,2018-09-14 16:51:28,convallis morbi odio odio elementum eu interdum eu tincidunt,cancelled
867,2020-01-21 17:23:17,2020-01-21 02:26:52,vitae nisi nam ultrices libero non mattis pulvinar nulla pede,set
868,2020-05-20 00:59:03,2020-05-20 02:10:01,penatibus et magnis dis parturient montes nascetur ridiculus mus etiam vel augue,cancelled
869,2019-02-24 17:00:32,2019-02-24 09:46:02,lacinia erat vestibulum sed magna at nunc commodo placerat praesent blandit nam,cancelled
870,2019-09-04 00:19:11,2019-09-04 05:18:57,sagittis sapien cum sociis natoque penatibus,set
871,2019-07-23 03:13:24,2019-07-23 23:55:34,erat vestibulum sed magna at nunc commodo placerat,set
872,2018-11-01 01:34:12,2018-11-01 11:00:41,in quam fringilla rhoncus mauris enim leo rhoncus sed,cancelled
873,2019-04-16 02:12:47,2019-04-16 15:25:45,rutrum rutrum neque aenean auctor gravida,cancelled
874,2020-07-24 21:44:57,2020-07-24 22:55:00,ligula nec sem duis aliquam convallis nunc proin at turpis a,set
875,2019-11-15 11:31:46,2019-11-15 15:20:10,ac consequat metus sapien ut nunc vestibulum ante ipsum primis in faucibus,cancelled
876,2019-02-28 19:19:34,2019-02-28 01:09:11,placerat praesent blandit nam nulla integer pede justo lacinia eget,set
877,2020-07-08 04:46:43,2020-07-08 02:59:16,vel dapibus at diam nam tristique tortor,cancelled
878,2019-07-27 14:14:20,2019-07-27 17:22:39,cursus vestibulum proin eu mi nulla ac enim in tempor turpis,set
879,2018-12-05 10:52:27,2018-12-05 22:40:59,posuere cubilia curae nulla dapibus dolor vel est donec,cancelled
880,2019-05-09 04:38:14,2019-05-09 08:59:29,lectus in quam fringilla rhoncus mauris enim leo rhoncus sed,set
881,2020-03-10 12:39:08,2020-03-10 09:22:39,mi in porttitor pede justo eu massa donec dapibus duis at,set
882,2020-07-15 11:08:09,2020-07-15 13:22:27,dapibus dolor vel est donec odio justo,set
883,2019-01-25 07:02:16,2019-01-25 21:41:06,curabitur gravida nisi at nibh in hac habitasse platea dictumst aliquam,set
884,2019-12-23 04:24:56,2019-12-23 09:44:36,molestie sed justo pellentesque viverra pede ac diam,set
885,2019-08-15 13:04:20,2019-08-15 13:10:53,eleifend luctus ultricies eu nibh quisque id justo,set
886,2018-09-28 23:03:15,2018-09-28 20:26:08,odio condimentum id luctus nec molestie sed,cancelled
887,2019-01-22 21:42:16,2019-01-22 19:04:50,odio condimentum id luctus nec molestie sed justo pellentesque viverra pede,cancelled
888,2019-04-08 20:24:13,2019-04-08 04:15:17,pellentesque eget nunc donec quis orci eget orci,set
889,2019-07-13 15:41:30,2019-07-13 20:42:52,luctus et ultrices posuere cubilia curae donec pharetra magna,cancelled
890,2019-02-01 10:29:14,2019-02-01 01:31:15,erat tortor sollicitudin mi sit amet,cancelled
891,2020-02-06 19:35:35,2020-02-06 03:54:51,curabitur convallis duis consequat dui nec nisi volutpat eleifend donec ut,set
892,2019-07-20 11:45:11,2019-07-20 07:38:28,primis in faucibus orci luctus et ultrices posuere,cancelled
893,2019-06-25 12:56:51,2019-06-25 07:44:54,semper porta volutpat quam pede lobortis ligula sit amet eleifend pede,cancelled
894,2018-07-29 13:54:34,2018-07-29 02:23:11,donec semper sapien a libero nam dui,set
895,2019-12-29 14:47:20,2019-12-29 18:18:57,aliquet at feugiat non pretium quis,set
896,2018-09-22 01:39:01,2018-09-22 20:23:04,rutrum at lorem integer tincidunt ante vel ipsum praesent blandit,set
897,2018-11-14 19:22:27,2018-11-14 19:41:01,facilisi cras non velit nec nisi vulputate nonummy maecenas tincidunt,cancelled
898,2019-01-06 00:05:50,2019-01-06 04:19:25,mauris sit amet eros suspendisse accumsan tortor quis turpis sed,cancelled
899,2018-09-11 01:02:29,2018-09-11 14:39:32,duis aliquam convallis nunc proin at turpis a pede posuere,set
900,2020-08-10 12:57:15,2020-08-10 09:14:41,pellentesque viverra pede ac diam cras pellentesque volutpat dui maecenas tristique,cancelled
901,2018-09-19 22:21:49,2018-09-19 14:06:11,non velit donec diam neque vestibulum eget vulputate ut ultrices vel augue,set
902,2020-01-31 06:50:35,2020-01-31 04:11:03,velit donec diam neque vestibulum eget vulputate ut ultrices vel,cancelled
903,2018-08-30 14:15:11,2018-08-30 18:10:08,ut nunc vestibulum ante ipsum primis in faucibus orci luctus et ultrices,set
904,2020-06-02 05:07:06,2020-06-02 10:18:47,in faucibus orci luctus et ultrices posuere cubilia curae,set
905,2019-03-31 02:48:09,2019-03-31 10:36:55,risus auctor sed tristique in tempus,set
906,2020-01-31 06:55:26,2020-01-31 16:48:08,etiam justo etiam pretium iaculis justo in hac habitasse platea dictumst,set
907,2020-05-08 19:16:08,2020-05-08 12:02:32,ultrices phasellus id sapien in sapien iaculis congue vivamus metus arcu,cancelled
908,2018-12-22 03:57:29,2018-12-22 19:16:16,potenti in eleifend quam a odio in hac habitasse platea dictumst maecenas,set
909,2020-05-16 23:21:43,2020-05-16 14:17:36,odio consequat varius integer ac leo pellentesque ultrices mattis odio donec vitae,cancelled
910,2019-05-16 23:15:14,2019-05-16 07:56:16,pede malesuada in imperdiet et commodo vulputate justo in blandit ultrices enim,cancelled
911,2018-11-19 08:15:22,2018-11-19 22:16:53,primis in faucibus orci luctus et ultrices posuere,set
912,2019-10-14 14:17:52,2019-10-14 10:46:27,suspendisse accumsan tortor quis turpis sed ante vivamus tortor duis,set
913,2018-05-27 19:28:31,2018-05-27 06:18:52,nullam porttitor lacus at turpis donec posuere metus,cancelled
914,2018-11-05 17:15:05,2018-11-05 23:18:53,tempus sit amet sem fusce consequat nulla nisl,set
915,2019-05-22 14:28:16,2019-05-22 16:53:15,mollis molestie lorem quisque ut erat curabitur gravida nisi at nibh in,set
916,2020-04-16 22:16:02,2020-04-16 22:12:01,cursus vestibulum proin eu mi nulla ac enim,cancelled
917,2018-07-31 05:24:14,2018-07-31 03:33:44,at velit eu est congue elementum,cancelled
918,2019-03-19 12:37:39,2019-03-19 15:16:22,volutpat dui maecenas tristique est et tempus semper est quam pharetra magna,set
919,2019-01-01 01:52:47,2019-01-01 17:24:51,molestie nibh in lectus pellentesque at nulla suspendisse potenti cras in,cancelled
920,2019-10-23 12:30:12,2019-10-23 15:43:34,pede lobortis ligula sit amet eleifend pede libero quis orci,set
921,2019-03-23 10:35:23,2019-03-23 21:00:34,in blandit ultrices enim lorem ipsum dolor,cancelled
922,2019-02-26 06:49:41,2019-02-26 18:08:54,vestibulum ante ipsum primis in faucibus orci luctus et ultrices posuere cubilia,cancelled
923,2018-12-01 06:35:09,2018-12-01 12:49:38,aliquam convallis nunc proin at turpis a pede posuere,set
924,2020-04-08 15:13:03,2020-04-08 10:13:44,vitae nisi nam ultrices libero non mattis pulvinar nulla,set
925,2018-10-14 07:42:57,2018-10-14 02:22:54,nullam molestie nibh in lectus pellentesque at nulla suspendisse potenti,cancelled
926,2020-04-27 01:01:30,2020-04-27 13:02:30,eu nibh quisque id justo sit amet,set
927,2020-02-10 20:35:42,2020-02-10 04:38:18,platea dictumst maecenas ut massa quis,set
928,2020-07-18 12:59:41,2020-07-18 04:06:25,leo pellentesque ultrices mattis odio donec vitae,cancelled
929,2020-04-14 21:51:10,2020-04-14 18:39:15,tristique fusce congue diam id ornare imperdiet sapien urna,set
930,2020-02-01 08:27:46,2020-02-01 11:13:30,justo in hac habitasse platea dictumst,cancelled
931,2019-06-14 03:33:24,2019-06-14 09:46:58,sit amet consectetuer adipiscing elit proin interdum,cancelled
932,2019-11-29 17:20:03,2019-11-29 02:08:09,ipsum integer a nibh in quis justo maecenas rhoncus aliquam,set
933,2019-07-17 06:17:16,2019-07-17 08:56:29,pellentesque quisque porta volutpat erat quisque erat eros viverra eget congue,set
934,2019-12-14 23:20:51,2019-12-14 09:38:14,interdum in ante vestibulum ante ipsum,cancelled
935,2018-09-17 08:46:31,2018-09-17 14:50:42,ut massa quis augue luctus tincidunt nulla mollis molestie,set
936,2019-01-14 05:47:53,2019-01-14 12:55:25,mauris enim leo rhoncus sed vestibulum sit amet cursus id turpis integer,set
937,2019-02-03 15:26:53,2019-02-03 22:01:56,in tempus sit amet sem fusce consequat nulla nisl nunc,cancelled
938,2020-01-25 15:05:11,2020-01-25 19:38:29,lectus pellentesque eget nunc donec quis orci eget orci vehicula condimentum curabitur,cancelled
939,2019-11-12 04:01:38,2019-11-12 04:09:21,ultrices aliquet maecenas leo odio condimentum id luctus,cancelled
940,2019-09-22 02:50:50,2019-09-22 00:24:29,pellentesque ultrices phasellus id sapien in,cancelled
941,2018-09-16 15:42:03,2018-09-16 03:12:34,duis faucibus accumsan odio curabitur convallis,cancelled
942,2019-04-14 04:30:35,2019-04-14 06:16:57,eget eleifend luctus ultricies eu nibh quisque id justo,cancelled
943,2018-05-29 16:12:26,2018-05-29 04:19:22,sagittis sapien cum sociis natoque penatibus et magnis dis parturient,set
944,2018-12-02 19:24:21,2018-12-02 15:51:21,velit nec nisi vulputate nonummy maecenas,set
945,2020-08-26 22:38:10,2020-08-26 19:20:28,a feugiat et eros vestibulum ac est lacinia nisi,cancelled
946,2020-04-07 21:11:07,2020-04-07 21:30:21,fusce posuere felis sed lacus morbi sem,set
947,2018-11-03 20:19:08,2018-11-03 08:58:48,lacinia erat vestibulum sed magna at nunc commodo placerat,set
948,2020-01-11 19:45:15,2020-01-11 08:43:21,accumsan felis ut at dolor quis odio,set
949,2020-02-13 22:05:52,2020-02-13 19:44:16,nibh in lectus pellentesque at nulla suspendisse,set
950,2019-08-08 16:08:46,2019-08-08 18:05:55,felis donec semper sapien a libero nam dui,set
