appointmentId,startDateAndTime,endDateAndTime,remarks,status
1,2020-04-10 17:21:46,2020-04-10 11:11:04,libero nullam sit amet turpis elementum ligula vehicula consequat,set
2,2019-05-21 16:10:46,2019-05-21 07:57:59,proin leo odio porttitor id consequat in consequat ut nulla sed,cancelled
3,2018-05-17 20:44:08,2018-05-17 22:04:48,ut nulla sed accumsan felis ut,set
4,2018-11-05 15:31:48,2018-11-05 15:35:14,ipsum integer a nibh in quis justo maecenas rhoncus aliquam lacus morbi,set
5,2019-09-18 10:49:30,2019-09-18 03:54:32,lacus at velit vivamus vel nulla eget eros elementum pellentesque quisque porta,set
6,2018-10-06 12:57:12,2018-10-06 19:50:10,sapien in sapien iaculis congue vivamus metus arcu adipiscing molestie hendrerit at,cancelled
7,2020-04-02 11:21:39,2020-04-02 04:59:23,nulla integer pede justo lacinia eget tincidunt eget tempus vel pede,set
8,2019-01-15 19:09:46,2019-01-15 04:36:26,posuere cubilia curae donec pharetra magna,set
9,2019-08-19 03:25:00,2019-08-19 03:36:13,convallis tortor risus dapibus augue vel accumsan tellus nisi eu orci,cancelled
10,2019-07-04 06:00:57,2019-07-04 19:31:29,vestibulum sit amet cursus id turpis,cancelled
11,2019-12-06 04:16:16,2019-12-06 14:34:27,et ultrices posuere cubilia curae nulla dapibus dolor vel est,set
12,2018-09-16 06:34:36,2018-09-16 08:25:45,luctus et ultrices posuere cubilia curae mauris viverra diam vitae quam,cancelled
13,2020-03-17 14:47:48,2020-03-17 19:22:37,dapibus dolor vel est donec odio justo sollicitudin ut suscipit,cancelled
14,2018-10-28 21:04:16,2018-10-28 08:23:02,leo odio porttitor id consequat in consequat,cancelled
15,2020-04-27 00:22:56,2020-04-27 01:21:43,maecenas ut massa quis augue luctus tincidunt nulla mollis,cancelled
16,2018-09-01 15:23:08,2018-09-01 19:56:30,metus arcu adipiscing molestie hendrerit at vulputate vitae nisl aenean lectus,cancelled
17,2019-11-17 04:05:51,2019-11-17 06:56:55,sem fusce consequat nulla nisl nunc nisl duis bibendum felis sed interdum,set
18,2019-08-29 09:37:18,2019-08-29 17:01:12,posuere cubilia curae nulla dapibus dolor vel est donec odio,set
19,2019-05-17 03:44:57,2019-05-17 11:35:15,sit amet turpis elementum ligula vehicula consequat morbi a ipsum integer,cancelled
20,2019-06-10 00:28:06,2019-06-10 11:04:42,non sodales sed tincidunt eu felis fusce posuere,set
21,2018-09-08 22:17:33,2018-09-08 15:10:02,massa donec dapibus duis at velit eu est congue elementum in,set
22,2020-07-14 16:05:59,2020-07-14 02:13:32,congue eget semper rutrum nulla nunc purus phasellus in felis donec semper,cancelled
23,2020-07-18 15:55:30,2020-07-18 03:42:16,natoque penatibus et magnis dis parturient montes nascetur ridiculus mus,set
24,2019-09-08 10:07:13,2019-09-08 02:01:00,diam neque vestibulum eget vulputate ut ultrices vel,cancelled
25,2019-07-30 11:05:46,2019-07-30 04:39:41,mollis molestie lorem quisque ut erat curabitur,set
26,2019-06-22 07:45:49,2019-06-22 18:16:58,massa tempor convallis nulla neque libero convallis eget eleifend luctus ultricies,cancelled
27,2019-04-27 12:37:23,2019-04-27 22:18:05,viverra pede ac diam cras pellentesque volutpat dui maecenas tristique,set
28,2018-05-28 09:55:50,2018-05-28 02:27:28,purus sit amet nulla quisque arcu libero rutrum ac,cancelled
29,2019-01-04 12:56:17,2019-01-04 08:08:43,pede libero quis orci nullam molestie nibh in lectus,cancelled
30,2020-09-05 03:17:31,2020-09-05 23:59:36,diam nam tristique tortor eu pede,set
31,2019-10-19 07:06:41,2019-10-19 12:37:20,lorem ipsum dolor sit amet consectetuer adipiscing,cancelled
32,2018-10-01 00:56:53,2018-10-01 04:41:54,proin eu mi nulla ac enim in tempor turpis nec euismod scelerisque,set
33,2020-03-10 16:52:03,2020-03-10 19:17:05,ipsum integer a nibh in quis justo maecenas rhoncus,set
34,2019-04-06 07:43:46,2019-04-06 14:43:26,maecenas tincidunt lacus at velit vivamus vel nulla eget,cancelled
35,2020-07-16 17:49:30,2020-07-16 01:29:01,sapien urna pretium nisl ut volutpat sapien arcu sed augue,set
36,2020-03-20 17:19:57,2020-03-20 15:58:17,nibh quisque id justo sit amet sapien,set
37,2018-05-30 14:20:41,2018-05-30 16:34:07,integer non velit donec diam neque vestibulum,set
38,2019-04-17 11:48:42,2019-04-17 15:01:01,dapibus augue vel accumsan tellus nisi,cancelled
39,2020-02-16 03:31:52,2020-02-16 19:43:47,pellentesque ultrices mattis odio donec vitae,cancelled
40,2019-10-02 19:01:38,2019-10-02 05:42:40,amet sem fusce consequat nulla nisl nunc,cancelled
41,2019-01-13 13:02:00,2019-01-13 21:33:13,erat volutpat in congue etiam justo etiam pretium iaculis justo,cancelled
42,2018-07-20 08:48:14,2018-07-20 12:55:26,hac habitasse platea dictumst etiam faucibus cursus urna ut tellus nulla ut,set
43,2018-07-06 02:50:04,2018-07-06 04:44:47,orci luctus et ultrices posuere cubilia curae nulla dapibus dolor vel est,cancelled
44,2020-07-13 04:39:43,2020-07-13 22:49:20,tortor duis mattis egestas metus aenean fermentum donec,cancelled
45,2018-06-17 17:19:50,2018-06-17 01:34:20,sagittis dui vel nisl duis ac nibh fusce lacus purus aliquet,set
46,2019-04-18 23:03:52,2019-04-18 15:03:16,amet sapien dignissim vestibulum vestibulum ante ipsum,cancelled
47,2019-01-16 14:05:07,2019-01-16 03:58:18,in libero ut massa volutpat convallis morbi odio odio elementum,set
48,2018-06-05 15:33:20,2018-06-05 22:28:36,tortor id nulla ultrices aliquet maecenas leo odio,set
49,2019-01-29 19:26:10,2019-01-29 04:17:48,erat tortor sollicitudin mi sit amet lobortis sapien sapien,cancelled
50,2018-10-19 13:34:36,2018-10-19 20:53:35,sit amet turpis elementum ligula vehicula,set
51,2019-11-03 23:14:22,2019-11-03 00:03:28,venenatis lacinia aenean sit amet justo morbi ut odio,cancelled
52,2020-03-18 10:24:55,2020-03-18 18:43:37,vel ipsum praesent blandit lacinia erat vestibulum sed magna,set
53,2018-09-10 14:12:49,2018-09-10 19:21:21,sit amet sapien dignissim vestibulum vestibulum ante ipsum,cancelled
54,2019-03-04 03:51:59,2019-03-04 18:15:11,consectetuer adipiscing elit proin risus praesent,set
55,2019-06-01 17:54:42,2019-06-01 20:13:09,integer tincidunt ante vel ipsum praesent blandit lacinia erat vestibulum sed magna,cancelled
56,2019-08-13 15:12:43,2019-08-13 11:21:58,justo in hac habitasse platea dictumst etiam faucibus cursus,cancelled
57,2019-05-05 01:33:13,2019-05-05 04:26:35,a odio in hac habitasse platea,set
58,2020-05-14 10:40:43,2020-05-14 00:40:08,in est risus auctor sed tristique in tempus sit,cancelled
59,2018-08-23 23:30:46,2018-08-23 12:42:30,quam sollicitudin vitae consectetuer eget rutrum at lorem,cancelled
60,2019-12-19 01:03:39,2019-12-19 05:45:31,sagittis dui vel nisl duis ac nibh fusce lacus purus aliquet at,set
61,2018-07-12 21:48:30,2018-07-12 16:28:48,orci mauris lacinia sapien quis libero nullam,cancelled
62,2020-08-21 08:12:45,2020-08-21 02:42:39,mi in porttitor pede justo eu,cancelled
63,2020-07-27 05:48:49,2020-07-27 20:41:31,vitae consectetuer eget rutrum at lorem integer tincidunt ante vel,cancelled
64,2020-05-19 18:03:31,2020-05-19 20:17:43,cubilia curae nulla dapibus dolor vel,cancelled
65,2019-10-20 18:20:21,2019-10-20 05:53:06,vel augue vestibulum rutrum rutrum neque,set
66,2018-12-11 00:16:09,2018-12-11 23:01:14,vivamus metus arcu adipiscing molestie hendrerit at vulputate vitae nisl aenean,set
67,2019-07-30 13:07:34,2019-07-30 08:50:29,magnis dis parturient montes nascetur ridiculus mus,cancelled
68,2019-01-07 16:53:21,2019-01-07 04:24:36,ultrices vel augue vestibulum ante ipsum primis in faucibus orci,set
69,2018-12-05 12:39:10,2018-12-05 05:14:39,in faucibus orci luctus et ultrices posuere cubilia curae nulla dapibus dolor,cancelled
70,2019-08-02 02:37:35,2019-08-02 01:37:35,ac est lacinia nisi venenatis tristique fusce congue diam id ornare imperdiet,cancelled
71,2018-11-06 02:14:29,2018-11-06 21:47:04,lorem id ligula suspendisse ornare consequat lectus in est risus auctor sed,set
72,2019-03-02 17:26:28,2019-03-02 07:32:10,faucibus orci luctus et ultrices posuere cubilia curae,cancelled
73,2018-11-20 10:33:25,2018-11-20 19:33:13,nulla ultrices aliquet maecenas leo odio condimentum id luctus,cancelled
74,2020-05-26 14:37:44,2020-05-26 16:40:47,elit sodales scelerisque mauris sit amet eros,set
75,2018-06-10 22:37:29,2018-06-10 21:16:20,iaculis congue vivamus metus arcu adipiscing molestie hendrerit,cancelled
76,2019-06-23 07:12:31,2019-06-23 06:37:07,nulla tempus vivamus in felis eu sapien cursus vestibulum,set
77,2018-07-24 13:56:31,2018-07-24 08:10:57,vel accumsan tellus nisi eu orci mauris lacinia sapien,cancelled
78,2018-08-23 01:37:09,2018-08-23 01:52:02,interdum eu tincidunt in leo maecenas pulvinar lobortis est phasellus sit,cancelled
79,2020-01-22 05:54:26,2020-01-22 20:28:13,lobortis ligula sit amet eleifend pede libero quis orci nullam,set
80,2020-05-17 01:57:37,2020-05-17 15:46:26,vestibulum ac est lacinia nisi venenatis tristique,set
81,2019-08-20 16:59:55,2019-08-20 04:20:19,donec diam neque vestibulum eget vulputate,cancelled
82,2019-08-07 12:12:50,2019-08-07 15:24:03,gravida nisi at nibh in hac habitasse platea dictumst aliquam,set
83,2019-10-16 02:09:44,2019-10-16 14:21:04,nisl venenatis lacinia aenean sit amet justo morbi ut,set
84,2019-06-29 10:32:23,2019-06-29 08:03:38,lectus suspendisse potenti in eleifend quam a odio,cancelled
85,2018-08-31 04:23:18,2018-08-31 22:27:29,sem sed sagittis nam congue risus semper porta volutpat,cancelled
86,2018-12-20 00:01:59,2018-12-20 15:04:50,venenatis tristique fusce congue diam id,set
87,2020-03-08 15:32:48,2020-03-08 03:01:18,sapien ut nunc vestibulum ante ipsum primis in faucibus orci luctus,cancelled
88,2020-07-05 17:37:13,2020-07-05 20:04:13,sit amet eleifend pede libero quis,set
89,2019-04-13 04:21:31,2019-04-13 23:31:32,et commodo vulputate justo in blandit ultrices enim lorem ipsum dolor,cancelled
90,2018-09-20 03:42:27,2018-09-20 21:14:59,vitae quam suspendisse potenti nullam porttitor lacus at turpis donec posuere metus,cancelled
91,2018-09-22 12:47:26,2018-09-22 01:17:52,auctor sed tristique in tempus sit amet sem fusce,set
92,2020-03-20 22:05:13,2020-03-20 15:16:27,semper porta volutpat quam pede lobortis ligula sit amet eleifend pede,cancelled
93,2019-12-15 10:58:22,2019-12-15 04:01:30,cras pellentesque volutpat dui maecenas tristique est et tempus,set
94,2018-05-28 12:35:28,2018-05-28 18:55:58,dui maecenas tristique est et tempus semper est,cancelled
95,2019-05-21 07:16:13,2019-05-21 01:31:14,ac enim in tempor turpis nec euismod scelerisque quam turpis adipiscing lorem,cancelled
96,2019-11-15 10:03:20,2019-11-15 14:57:14,pellentesque ultrices mattis odio donec vitae nisi nam ultrices,set
97,2019-03-21 15:30:26,2019-03-21 01:59:13,suspendisse accumsan tortor quis turpis sed ante,cancelled
98,2019-06-19 19:28:08,2019-06-19 19:10:51,justo maecenas rhoncus aliquam lacus morbi quis tortor id nulla,set
99,2018-09-14 11:11:38,2018-09-14 13:12:35,nunc viverra dapibus nulla suscipit ligula in,cancelled
100,2019-12-18 16:26:51,2019-12-18 09:14:52,lacus morbi sem mauris laoreet ut rhoncus aliquet,set
101,2020-07-29 21:54:23,2020-07-29 11:22:26,mattis egestas metus aenean fermentum donec ut mauris eget,set
102,2019-12-31 18:22:18,2019-12-31 09:03:21,ut nulla sed accumsan felis ut at dolor quis odio consequat varius,set
103,2019-03-22 21:42:32,2019-03-22 06:50:13,justo maecenas rhoncus aliquam lacus morbi quis tortor,set
104,2020-02-14 17:53:44,2020-02-14 08:14:08,consequat nulla nisl nunc nisl duis bibendum felis sed interdum venenatis turpis,cancelled
105,2020-01-27 04:35:30,2020-01-27 02:30:52,velit id pretium iaculis diam erat fermentum justo nec condimentum neque,cancelled
106,2018-07-23 14:51:20,2018-07-23 16:12:11,luctus nec molestie sed justo pellentesque viverra pede ac diam,cancelled
107,2018-10-10 23:47:26,2018-10-10 23:43:27,consequat dui nec nisi volutpat eleifend donec,set
108,2020-02-21 19:56:53,2020-02-21 14:00:30,dapibus duis at velit eu est congue elementum,cancelled
109,2020-01-03 22:54:22,2020-01-03 22:55:00,ut rhoncus aliquet pulvinar sed nisl,set
110,2018-11-23 01:20:26,2018-11-23 22:57:54,cum sociis natoque penatibus et magnis dis parturient montes,set
111,2018-08-31 09:44:30,2018-08-31 03:56:47,vel nulla eget eros elementum pellentesque quisque porta,set
112,2019-02-02 09:43:16,2019-02-02 11:27:36,mi nulla ac enim in tempor turpis nec euismod scelerisque quam turpis,cancelled
113,2020-01-06 22:36:27,2020-01-06 20:57:42,mauris viverra diam vitae quam suspendisse potenti nullam porttitor lacus,cancelled
114,2020-02-20 13:39:41,2020-02-20 20:15:36,fusce posuere felis sed lacus morbi sem mauris laoreet,set
115,2020-07-28 00:30:53,2020-07-28 13:56:24,luctus et ultrices posuere cubilia curae,cancelled
116,2019-03-12 21:33:07,2019-03-12 00:59:26,ut dolor morbi vel lectus in quam,set
117,2019-07-28 12:08:54,2019-07-28 13:43:19,sem fusce consequat nulla nisl nunc,set
118,2020-02-22 22:28:14,2020-02-22 02:07:39,in felis donec semper sapien a libero nam dui proin leo,cancelled
119,2020-09-04 23:08:16,2020-09-04 17:08:20,vehicula condimentum curabitur in libero ut massa volutpat convallis morbi odio odio,set
120,2018-10-10 15:31:13,2018-10-10 01:00:24,bibendum morbi non quam nec dui luctus,set
121,2018-05-16 12:14:13,2018-05-16 17:16:12,luctus et ultrices posuere cubilia curae duis faucibus accumsan,set
122,2019-01-15 04:20:15,2019-01-15 18:29:59,id mauris vulputate elementum nullam varius,set
123,2019-08-25 19:07:22,2019-08-25 15:44:44,nunc vestibulum ante ipsum primis in faucibus orci luctus,set
124,2019-08-29 04:26:38,2019-08-29 01:17:17,amet diam in magna bibendum imperdiet nullam orci pede venenatis non sodales,cancelled
125,2019-12-05 21:33:21,2019-12-05 01:50:12,volutpat eleifend donec ut dolor morbi vel,set
126,2018-12-12 18:24:13,2018-12-12 07:52:01,id luctus nec molestie sed justo pellentesque viverra,cancelled
127,2019-02-27 15:17:52,2019-02-27 12:43:26,nibh fusce lacus purus aliquet at,set
128,2020-09-03 05:53:06,2020-09-03 00:37:05,sapien quis libero nullam sit amet turpis,set
129,2019-07-21 04:26:37,2019-07-21 13:01:27,erat fermentum justo nec condimentum neque sapien placerat,cancelled
130,2020-07-24 00:39:48,2020-07-24 13:28:39,libero convallis eget eleifend luctus ultricies eu nibh quisque,cancelled
131,2019-06-17 16:32:23,2019-06-17 18:43:43,habitasse platea dictumst morbi vestibulum velit id pretium iaculis diam erat,cancelled
132,2020-04-05 07:00:01,2020-04-05 00:00:48,duis at velit eu est congue elementum in hac,cancelled
133,2019-12-12 11:31:28,2019-12-12 05:09:16,arcu adipiscing molestie hendrerit at vulputate vitae nisl aenean,cancelled
134,2019-10-31 01:35:41,2019-10-31 14:53:44,pellentesque eget nunc donec quis orci eget orci vehicula condimentum,set
135,2019-03-21 01:52:41,2019-03-21 05:35:34,leo pellentesque ultrices mattis odio donec vitae nisi nam ultrices libero non,set
136,2019-11-07 16:00:17,2019-11-07 03:09:35,ipsum integer a nibh in quis justo maecenas rhoncus aliquam,cancelled
137,2018-06-24 04:41:21,2018-06-24 13:08:26,lacus morbi quis tortor id nulla ultrices,cancelled
138,2019-07-01 04:51:29,2019-07-01 05:51:19,lacus morbi quis tortor id nulla ultrices aliquet maecenas leo odio,set
139,2019-12-27 19:06:14,2019-12-27 22:11:12,risus auctor sed tristique in tempus sit amet sem fusce consequat,cancelled
140,2019-05-31 14:00:05,2019-05-31 06:26:58,mauris viverra diam vitae quam suspendisse,set
141,2018-11-24 23:54:47,2018-11-24 16:14:57,sit amet turpis elementum ligula vehicula consequat morbi a ipsum integer,cancelled
142,2018-09-10 12:37:14,2018-09-10 00:21:40,mi in porttitor pede justo eu massa donec dapibus duis at,set
143,2020-07-20 04:17:06,2020-07-20 00:33:42,sapien sapien non mi integer ac neque duis bibendum morbi non,set
144,2020-08-29 23:56:10,2020-08-29 20:45:38,diam id ornare imperdiet sapien urna pretium nisl,cancelled
145,2020-03-16 08:43:19,2020-03-16 18:29:48,cras non velit nec nisi vulputate nonummy maecenas tincidunt,cancelled
146,2020-03-05 05:00:16,2020-03-05 02:12:58,lobortis vel dapibus at diam nam tristique,cancelled
147,2019-04-14 01:21:26,2019-04-14 20:32:43,elit ac nulla sed vel enim sit amet nunc viverra dapibus,cancelled
148,2019-08-09 15:43:27,2019-08-09 20:54:59,aliquam quis turpis eget elit sodales scelerisque,set
149,2019-03-16 14:29:37,2019-03-16 10:48:34,nulla ac enim in tempor turpis nec euismod scelerisque,set
150,2018-10-24 19:27:40,2018-10-24 03:36:43,habitasse platea dictumst etiam faucibus cursus urna,set
151,2020-02-28 06:10:30,2020-02-28 16:14:32,cubilia curae mauris viverra diam vitae quam suspendisse potenti nullam porttitor,cancelled
152,2019-04-03 00:17:11,2019-04-03 09:56:26,in felis donec semper sapien a libero,set
153,2019-02-01 08:11:17,2019-02-01 09:47:49,eget nunc donec quis orci eget orci vehicula,cancelled
154,2020-08-22 00:56:55,2020-08-22 11:33:26,molestie lorem quisque ut erat curabitur gravida nisi at nibh in hac,set
155,2019-01-17 17:27:06,2019-01-17 18:23:33,risus dapibus augue vel accumsan tellus nisi eu orci mauris lacinia sapien,set
156,2020-06-06 15:33:31,2020-06-06 03:28:00,elit proin interdum mauris non ligula pellentesque ultrices phasellus,cancelled
157,2020-02-07 06:02:16,2020-02-07 21:26:44,et eros vestibulum ac est lacinia nisi venenatis tristique fusce congue diam,cancelled
158,2019-10-21 12:28:34,2019-10-21 01:25:25,vestibulum vestibulum ante ipsum primis in faucibus orci luctus et ultrices posuere,cancelled
159,2018-11-10 08:39:02,2018-11-10 02:24:26,vel augue vestibulum ante ipsum primis in,cancelled
160,2020-07-30 07:53:06,2020-07-30 05:54:15,donec posuere metus vitae ipsum aliquam non mauris morbi non lectus aliquam,set
161,2019-07-19 01:54:02,2019-07-19 05:42:19,ut nulla sed accumsan felis ut at dolor,set
162,2019-07-23 10:59:22,2019-07-23 12:00:37,luctus et ultrices posuere cubilia curae mauris viverra diam vitae quam,cancelled
163,2019-08-09 18:52:01,2019-08-09 13:23:25,interdum venenatis turpis enim blandit mi in porttitor pede justo eu massa,set
164,2019-05-18 22:31:33,2019-05-18 20:35:18,in lacus curabitur at ipsum ac tellus semper interdum mauris ullamcorper purus,cancelled
165,2019-05-07 15:55:14,2019-05-07 06:25:31,quis odio consequat varius integer ac leo pellentesque,cancelled
166,2019-06-30 09:26:01,2019-06-30 15:18:55,nulla facilisi cras non velit nec,set
167,2019-08-01 11:39:59,2019-08-01 23:41:41,amet eleifend pede libero quis orci nullam molestie,cancelled
168,2019-08-27 17:44:41,2019-08-27 15:24:08,neque vestibulum eget vulputate ut ultrices vel,set
169,2019-03-18 03:00:47,2019-03-18 00:44:03,justo lacinia eget tincidunt eget tempus,cancelled
170,2018-11-07 17:27:53,2018-11-07 05:53:18,elementum pellentesque quisque porta volutpat erat quisque erat eros viverra,cancelled
171,2019-07-08 07:53:31,2019-07-08 08:18:41,in porttitor pede justo eu massa donec,set
172,2019-03-07 22:45:46,2019-03-07 05:59:58,massa quis augue luctus tincidunt nulla mollis molestie lorem,cancelled
173,2019-10-17 18:37:38,2019-10-17 12:34:01,in ante vestibulum ante ipsum primis,cancelled
174,2019-05-15 01:34:48,2019-05-15 12:20:31,adipiscing elit proin interdum mauris non ligula pellentesque ultrices phasellus id,cancelled
175,2020-08-21 03:47:23,2020-08-21 18:55:31,dolor quis odio consequat varius integer ac leo pellentesque ultrices,set
176,2018-12-15 12:30:46,2018-12-15 15:37:09,mattis pulvinar nulla pede ullamcorper augue a suscipit nulla,cancelled
177,2020-05-02 09:04:30,2020-05-02 00:00:40,nibh fusce lacus purus aliquet at feugiat non pretium quis,cancelled
178,2019-07-30 07:12:53,2019-07-30 09:34:45,tincidunt ante vel ipsum praesent blandit lacinia erat vestibulum sed magna,cancelled
179,2020-03-21 04:16:42,2020-03-21 06:37:53,vitae nisl aenean lectus pellentesque eget nunc donec quis orci eget orci,set
180,2020-05-28 03:25:40,2020-05-28 04:27:18,donec ut mauris eget massa tempor convallis nulla neque,set
181,2019-07-28 05:06:43,2019-07-28 12:57:14,ante ipsum primis in faucibus orci luctus et ultrices posuere cubilia curae,set
182,2018-11-16 04:20:13,2018-11-16 19:09:09,dolor sit amet consectetuer adipiscing elit proin interdum mauris,cancelled
183,2020-07-29 16:48:46,2020-07-29 08:19:38,congue etiam justo etiam pretium iaculis justo,set
184,2020-04-28 21:00:43,2020-04-28 06:25:26,quam fringilla rhoncus mauris enim leo rhoncus sed vestibulum sit,set
185,2019-03-21 19:26:06,2019-03-21 05:28:01,mauris viverra diam vitae quam suspendisse potenti nullam porttitor lacus at,cancelled
186,2018-10-06 11:51:29,2018-10-06 20:13:47,sed interdum venenatis turpis enim blandit mi in,set
187,2018-08-02 21:58:03,2018-08-02 00:05:51,pede justo eu massa donec dapibus,set
188,2020-03-20 01:11:37,2020-03-20 20:37:21,semper interdum mauris ullamcorper purus sit amet nulla,cancelled
189,2018-07-05 11:56:44,2018-07-05 01:09:31,metus vitae ipsum aliquam non mauris morbi non lectus aliquam sit amet,cancelled
190,2019-12-21 15:08:52,2019-12-21 11:59:44,non velit donec diam neque vestibulum,set
191,2019-07-09 01:20:34,2019-07-09 11:21:29,metus aenean fermentum donec ut mauris eget massa tempor,cancelled
192,2019-06-04 20:15:53,2019-06-04 11:36:40,quis orci nullam molestie nibh in lectus pellentesque at,set
193,2020-04-27 23:38:03,2020-04-27 15:35:16,non mattis pulvinar nulla pede ullamcorper augue a,cancelled
194,2019-11-27 10:54:56,2019-11-27 03:00:02,nulla ut erat id mauris vulputate elementum,cancelled
195,2020-09-13 15:06:36,2020-09-13 10:43:43,eu magna vulputate luctus cum sociis natoque penatibus et,set
196,2019-03-30 12:04:27,2019-03-30 03:22:37,commodo placerat praesent blandit nam nulla integer pede,cancelled
197,2018-06-02 10:34:57,2018-06-02 13:53:34,pede ullamcorper augue a suscipit nulla elit ac,cancelled
198,2020-02-22 22:28:25,2020-02-22 08:08:45,phasellus in felis donec semper sapien a libero nam dui proin,set
199,2018-12-20 01:44:55,2018-12-20 10:52:38,vestibulum rutrum rutrum neque aenean auctor,cancelled
200,2019-04-30 20:32:01,2019-04-30 23:14:15,mauris non ligula pellentesque ultrices phasellus id sapien,set
201,2020-04-19 12:18:51,2020-04-19 03:39:51,ligula vehicula consequat morbi a ipsum integer a,cancelled
202,2020-04-08 06:38:48,2020-04-08 11:18:24,sed accumsan felis ut at dolor quis,set
203,2018-06-04 10:56:46,2018-06-04 08:34:01,ante vivamus tortor duis mattis egestas metus aenean fermentum donec ut,cancelled
204,2020-07-19 17:14:09,2020-07-19 05:23:10,pellentesque viverra pede ac diam cras pellentesque volutpat dui maecenas,set
205,2020-09-04 22:52:42,2020-09-04 21:05:19,felis sed lacus morbi sem mauris laoreet,set
206,2020-05-13 07:37:07,2020-05-13 09:57:10,pede justo eu massa donec dapibus,set
207,2018-11-03 23:49:04,2018-11-03 16:46:41,nulla ut erat id mauris vulputate elementum,cancelled
208,2020-04-09 02:31:31,2020-04-09 12:48:53,quam fringilla rhoncus mauris enim leo rhoncus sed vestibulum sit amet,cancelled
209,2018-08-31 18:41:05,2018-08-31 09:00:35,justo in hac habitasse platea dictumst etiam faucibus cursus urna,set
210,2019-01-20 15:49:27,2019-01-20 18:23:42,curae mauris viverra diam vitae quam,cancelled
211,2018-07-13 13:08:42,2018-07-13 06:40:15,amet erat nulla tempus vivamus in felis eu sapien cursus,cancelled
212,2018-12-23 03:30:01,2018-12-23 14:05:00,viverra eget congue eget semper rutrum nulla nunc purus phasellus in,cancelled
213,2019-06-29 12:47:26,2019-06-29 04:45:31,nibh fusce lacus purus aliquet at feugiat non pretium,cancelled
214,2020-08-06 21:34:07,2020-08-06 22:28:34,sapien cum sociis natoque penatibus et magnis dis parturient montes nascetur ridiculus,set
215,2019-03-18 03:49:35,2019-03-18 17:55:30,nisi volutpat eleifend donec ut dolor morbi vel lectus in quam fringilla,set
216,2019-01-18 10:04:37,2019-01-18 00:57:03,porttitor lorem id ligula suspendisse ornare,set
217,2020-01-04 12:26:35,2020-01-04 01:18:06,tempor convallis nulla neque libero convallis eget eleifend luctus ultricies eu nibh,cancelled
218,2019-05-03 07:53:23,2019-05-03 11:32:00,purus phasellus in felis donec semper sapien a libero nam dui proin,set
219,2019-10-29 10:27:17,2019-10-29 21:27:53,consequat dui nec nisi volutpat eleifend donec ut,set
220,2019-04-09 05:20:41,2019-04-09 05:03:13,a nibh in quis justo maecenas rhoncus aliquam lacus morbi,cancelled
221,2019-03-03 06:11:12,2019-03-03 13:15:06,turpis adipiscing lorem vitae mattis nibh ligula nec,set
222,2019-09-23 18:03:43,2019-09-23 14:47:09,ultrices vel augue vestibulum ante ipsum primis in faucibus orci luctus,cancelled
223,2019-07-02 19:03:23,2019-07-02 04:34:14,sapien quis libero nullam sit amet turpis elementum,set
224,2020-03-08 08:33:40,2020-03-08 22:08:45,proin at turpis a pede posuere nonummy integer non velit,set
225,2019-08-21 11:49:28,2019-08-21 03:42:40,porttitor lorem id ligula suspendisse ornare consequat lectus in est risus auctor,cancelled
226,2020-08-18 03:38:09,2020-08-18 11:04:41,felis donec semper sapien a libero nam dui,set
227,2019-05-18 05:05:46,2019-05-18 00:41:04,in sapien iaculis congue vivamus metus arcu adipiscing,set
228,2020-08-27 12:43:28,2020-08-27 15:06:33,sapien sapien non mi integer ac neque duis bibendum morbi non,cancelled
229,2019-08-19 21:39:22,2019-08-19 05:19:37,amet nulla quisque arcu libero rutrum ac lobortis vel,set
230,2020-05-12 11:32:11,2020-05-12 20:59:49,lorem id ligula suspendisse ornare consequat lectus in est risus auctor,cancelled
231,2019-07-19 08:23:56,2019-07-19 01:25:09,sed interdum venenatis turpis enim blandit mi in porttitor pede,cancelled
232,2018-09-08 00:23:00,2018-09-08 01:39:39,augue vestibulum rutrum rutrum neque aenean auctor gravida sem praesent,set
233,2019-11-23 21:28:53,2019-11-23 17:17:48,ultrices aliquet maecenas leo odio condimentum id luctus nec molestie,cancelled
234,2018-09-02 07:05:37,2018-09-02 02:13:55,platea dictumst aliquam augue quam sollicitudin vitae consectetuer eget,set
235,2019-09-25 16:42:19,2019-09-25 21:06:33,vestibulum sed magna at nunc commodo placerat,cancelled
236,2019-12-08 16:54:53,2019-12-08 01:36:34,auctor sed tristique in tempus sit amet sem fusce consequat nulla nisl,cancelled
237,2020-02-09 15:03:22,2020-02-09 00:56:20,sed accumsan felis ut at dolor quis,set
