appointmentId,startDateAndTime,endDateAndTime,remarks,status
238,2019-07-21 04:13:50,2019-07-21 03:30:14,aliquet at feugiat non pretium quis lectus,set
239,2019-10-08 18:32:41,2019-10-08 12:04:52,a suscipit nulla elit ac nulla,set
240,2018-08-29 03:51:58,2018-08-29 08:07:46,blandit lacinia erat vestibulum sed magna at nunc commodo placerat praesent,cancelled
241,2018-10-06 12:12:25,2018-10-06 12:27:05,duis aliquam convallis nunc proin at,cancelled
242,2018-11-12 21:21:01,2018-11-12 06:13:14,ac tellus semper interdum mauris ullamcorper,cancelled
243,2020-05-26 21:50:55,2020-05-26 16:12:31,turpis enim blandit mi in porttitor,set
244,2019-12-23 12:53:34,2019-12-23 10:32:27,tincidunt ante vel ipsum praesent blandit,set
245,2019-07-21 07:00:45,2019-07-21 20:23:04,eros suspendisse accumsan tortor quis turpis sed ante vivamus,set
246,2019-09-14 05:00:36,2019-09-14 09:10:14,ante ipsum primis in faucibus orci luctus et ultrices posuere cubilia curae,set
247,2020-01-03 04:52:55,2020-01-03 11:59:57,phasellus sit amet erat nulla tempus vivamus in,set
248,2020-05-21 16:54:16,2020-05-21 07:45:28,a odio in hac habitasse platea,set
249,2018-06-24 16:15:14,2018-06-24 13:34:53,sollicitudin vitae consectetuer eget rutrum at lorem integer,set
250,2018-09-14 09:43:48,2018-09-14 17:25:03,justo sit amet sapien dignissim vestibulum vestibulum ante ipsum,set
251,2020-01-09 12:22:30,2020-01-09 04:04:41,donec quis orci eget orci vehicula condimentum curabitur in libero ut,cancelled
252,2020-04-05 09:53:52,2020-04-05 05:56:59,luctus tincidunt nulla mollis molestie lorem quisque ut erat curabitur gravida,cancelled
253,2020-01-28 10:49:55,2020-01-28 08:10:20,purus eu magna vulputate luctus cum sociis natoque penatibus et,set
254,2018-05-31 15:47:15,2018-05-31 02:15:59,blandit nam nulla integer pede justo,cancelled
255,2020-01-10 07:19:36,2020-01-10 23:55:37,dis parturient montes nascetur ridiculus mus,cancelled
256,2018-07-02 09:14:38,2018-07-02 07:46:45,magna vulputate luctus cum sociis natoque penatibus et magnis dis parturient montes,cancelled
257,2019-12-31 18:50:51,2019-12-31 22:22:03,lacus curabitur at ipsum ac tellus semper interdum mauris,cancelled
258,2020-04-05 09:27:07,2020-04-05 04:46:59,vel est donec odio justo sollicitudin ut suscipit a,set
259,2020-03-28 13:13:12,2020-03-28 05:30:27,viverra diam vitae quam suspendisse potenti nullam porttitor lacus at turpis,set
260,2020-01-14 10:09:05,2020-01-14 06:20:55,curabitur gravida nisi at nibh in hac habitasse platea dictumst,cancelled
261,2018-11-17 06:15:00,2018-11-17 20:46:03,ultrices posuere cubilia curae nulla dapibus,cancelled
262,2020-02-28 06:51:43,2020-02-28 19:55:01,felis sed interdum venenatis turpis enim,set
263,2018-05-21 02:53:48,2018-05-21 20:24:56,integer ac neque duis bibendum morbi non quam,set
264,2020-04-30 11:49:58,2020-04-30 00:08:29,morbi a ipsum integer a nibh in quis,set
265,2019-02-13 21:30:22,2019-02-13 01:40:21,mattis odio donec vitae nisi nam,cancelled
266,2018-10-18 05:00:23,2018-10-18 09:44:26,lobortis ligula sit amet eleifend pede libero quis orci nullam molestie nibh,set
267,2018-11-17 12:57:12,2018-11-17 05:27:02,convallis morbi odio odio elementum eu interdum eu tincidunt in leo,set
268,2018-06-25 14:52:09,2018-06-25 09:59:05,sit amet erat nulla tempus vivamus in,cancelled
269,2020-04-02 19:56:28,2020-04-02 07:38:00,consectetuer adipiscing elit proin risus praesent lectus vestibulum quam sapien varius ut,cancelled
270,2019-06-12 19:20:07,2019-06-12 01:03:31,faucibus orci luctus et ultrices posuere cubilia curae,set
271,2019-10-08 17:34:58,2019-10-08 16:19:23,convallis duis consequat dui nec nisi volutpat eleifend donec ut dolor morbi,cancelled
272,2019-02-20 10:08:54,2019-02-20 04:09:14,nulla sed accumsan felis ut at,set
273,2018-07-02 01:08:36,2018-07-02 21:16:05,luctus rutrum nulla tellus in sagittis dui vel nisl duis ac nibh,cancelled
274,2019-05-24 17:36:01,2019-05-24 10:49:54,non lectus aliquam sit amet diam in magna,set
275,2019-04-16 08:24:52,2019-04-16 07:49:37,interdum mauris non ligula pellentesque ultrices phasellus,set
276,2019-07-12 08:49:38,2019-07-12 06:29:31,feugiat non pretium quis lectus suspendisse potenti in eleifend,cancelled
277,2020-03-15 14:05:56,2020-03-15 10:42:11,vestibulum aliquet ultrices erat tortor sollicitudin mi sit amet lobortis,set
278,2020-09-09 08:58:50,2020-09-09 11:27:41,at lorem integer tincidunt ante vel,set
279,2019-03-03 02:26:46,2019-03-03 09:07:28,volutpat in congue etiam justo etiam pretium iaculis justo in,set
280,2020-08-08 23:39:58,2020-08-08 20:49:52,vulputate vitae nisl aenean lectus pellentesque eget nunc,set
281,2018-10-08 21:03:21,2018-10-08 10:13:29,rutrum at lorem integer tincidunt ante vel ipsum praesent blandit lacinia,cancelled
282,2020-06-10 23:27:18,2020-06-10 12:34:34,morbi quis tortor id nulla ultrices aliquet,cancelled
283,2018-06-03 11:28:31,2018-06-03 23:54:42,nec dui luctus rutrum nulla tellus in sagittis dui,set
284,2019-01-20 20:49:38,2019-01-20 13:17:56,platea dictumst morbi vestibulum velit id pretium iaculis,cancelled
285,2018-08-26 04:26:29,2018-08-26 20:02:12,leo pellentesque ultrices mattis odio donec,cancelled
286,2019-02-23 18:04:22,2019-02-23 09:51:23,vel enim sit amet nunc viverra dapibus nulla suscipit,cancelled
287,2018-12-10 18:08:26,2018-12-10 20:55:57,metus vitae ipsum aliquam non mauris morbi non,cancelled
288,2019-07-19 21:07:33,2019-07-19 13:50:07,accumsan odio curabitur convallis duis consequat,set
289,2019-07-25 03:45:45,2019-07-25 14:01:48,tincidunt nulla mollis molestie lorem quisque ut erat,set
290,2019-07-17 06:26:22,2019-07-17 19:51:38,porta volutpat erat quisque erat eros,set
291,2020-02-07 22:47:35,2020-02-07 11:20:07,aliquam lacus morbi quis tortor id nulla ultrices aliquet maecenas leo odio,cancelled
292,2018-11-07 17:21:41,2018-11-07 13:11:21,in libero ut massa volutpat convallis,cancelled
293,2020-03-09 15:50:12,2020-03-09 21:39:08,nibh in hac habitasse platea dictumst aliquam augue quam sollicitudin,cancelled
294,2019-08-19 18:15:22,2019-08-19 17:14:52,congue diam id ornare imperdiet sapien urna pretium nisl ut volutpat,set
295,2019-01-27 15:44:53,2019-01-27 20:10:59,praesent blandit lacinia erat vestibulum sed magna at nunc commodo placerat praesent,cancelled
296,2020-01-31 18:59:21,2020-01-31 21:21:01,volutpat quam pede lobortis ligula sit amet eleifend pede libero quis,cancelled
297,2019-09-02 20:58:50,2019-09-02 04:05:21,quis orci eget orci vehicula condimentum curabitur in libero,set
298,2019-11-27 16:29:59,2019-11-27 08:07:43,dis parturient montes nascetur ridiculus mus etiam,set
299,2018-10-20 15:41:24,2018-10-20 12:21:11,nulla sed vel enim sit amet nunc viverra,cancelled
300,2018-10-23 22:51:20,2018-10-23 23:13:37,luctus et ultrices posuere cubilia curae duis,set
301,2019-05-27 17:25:21,2019-05-27 10:47:27,risus dapibus augue vel accumsan tellus nisi eu,cancelled
302,2018-10-10 00:38:42,2018-10-10 08:21:20,curae duis faucibus accumsan odio curabitur convallis duis consequat dui,cancelled
303,2019-12-02 15:57:51,2019-12-02 16:34:45,morbi vel lectus in quam fringilla rhoncus mauris enim,cancelled
304,2018-08-08 09:23:17,2018-08-08 12:52:25,pede posuere nonummy integer non velit donec diam neque vestibulum eget,set
305,2019-01-10 15:39:42,2019-01-10 14:29:39,id nulla ultrices aliquet maecenas leo odio condimentum,cancelled
306,2020-04-14 18:35:00,2020-04-14 05:02:48,suspendisse potenti cras in purus eu magna,cancelled
307,2019-08-14 04:55:58,2019-08-14 07:59:06,blandit ultrices enim lorem ipsum dolor sit amet consectetuer adipiscing elit proin,set
308,2018-11-12 09:45:43,2018-11-12 06:30:55,congue diam id ornare imperdiet sapien urna pretium nisl,cancelled
309,2018-12-13 06:43:25,2018-12-13 08:03:22,id ligula suspendisse ornare consequat lectus in est risus,cancelled
310,2019-10-27 04:58:28,2019-10-27 14:54:36,accumsan tortor quis turpis sed ante vivamus tortor duis mattis egestas metus,set
311,2018-11-17 09:26:27,2018-11-17 21:44:07,volutpat dui maecenas tristique est et,cancelled
312,2020-07-01 14:28:52,2020-07-01 12:43:10,rutrum rutrum neque aenean auctor gravida sem,cancelled
313,2019-10-17 23:47:10,2019-10-17 00:53:38,cras non velit nec nisi vulputate nonummy maecenas,cancelled
314,2019-12-19 13:00:28,2019-12-19 13:40:56,quam suspendisse potenti nullam porttitor lacus at,cancelled
315,2018-12-25 17:46:14,2018-12-25 15:56:14,justo etiam pretium iaculis justo in,set
316,2018-05-19 07:52:37,2018-05-19 22:35:41,leo pellentesque ultrices mattis odio donec vitae nisi nam ultrices libero,cancelled
317,2020-04-19 00:13:33,2020-04-19 09:39:14,sed augue aliquam erat volutpat in,set
318,2019-08-18 04:06:41,2019-08-18 03:58:49,velit vivamus vel nulla eget eros elementum pellentesque,cancelled
319,2019-01-15 03:09:29,2019-01-15 23:19:40,curabitur convallis duis consequat dui nec nisi volutpat eleifend donec ut,cancelled
320,2020-03-23 18:41:57,2020-03-23 15:03:48,nulla integer pede justo lacinia eget tincidunt eget tempus,cancelled
321,2018-07-22 13:25:34,2018-07-22 09:23:00,pharetra magna vestibulum aliquet ultrices erat tortor sollicitudin mi,cancelled
322,2018-09-15 11:06:04,2018-09-15 03:46:07,erat quisque erat eros viverra eget congue eget,cancelled
323,2019-03-29 04:41:09,2019-03-29 11:23:25,turpis integer aliquet massa id lobortis convallis tortor,set
324,2020-04-15 17:09:58,2020-04-15 03:38:09,ultrices posuere cubilia curae mauris viverra diam vitae quam suspendisse potenti,set
325,2020-05-02 15:44:14,2020-05-02 03:09:23,nam dui proin leo odio porttitor,set
326,2020-01-06 01:07:48,2020-01-06 00:58:29,tempor turpis nec euismod scelerisque quam turpis adipiscing lorem,cancelled
327,2018-10-28 16:26:29,2018-10-28 05:39:11,condimentum id luctus nec molestie sed justo pellentesque,set
328,2019-11-29 13:40:20,2019-11-29 06:54:46,porta volutpat erat quisque erat eros viverra eget congue,cancelled
329,2020-01-22 01:14:30,2020-01-22 15:29:05,quisque erat eros viverra eget congue,cancelled
330,2020-01-06 13:02:45,2020-01-06 08:14:53,consectetuer adipiscing elit proin interdum mauris non ligula pellentesque ultrices phasellus,cancelled
331,2019-09-28 02:09:11,2019-09-28 02:03:39,suspendisse potenti cras in purus eu magna vulputate luctus cum,set
332,2019-01-28 17:29:45,2019-01-28 22:29:25,libero nullam sit amet turpis elementum ligula,set
333,2019-09-08 14:03:15,2019-09-08 22:17:46,aenean lectus pellentesque eget nunc donec quis,set
334,2018-08-15 01:24:12,2018-08-15 22:02:40,a libero nam dui proin leo odio porttitor,cancelled
335,2020-03-05 01:46:37,2020-03-05 03:09:01,duis mattis egestas metus aenean fermentum donec ut mauris eget massa,set
336,2018-10-15 17:31:15,2018-10-15 04:13:37,in lectus pellentesque at nulla suspendisse potenti cras in purus,set
337,2019-03-26 09:17:00,2019-03-26 13:18:25,ultrices aliquet maecenas leo odio condimentum id luctus nec molestie sed,cancelled
338,2019-02-04 20:14:58,2019-02-04 22:53:02,diam in magna bibendum imperdiet nullam,cancelled
339,2018-09-19 12:57:32,2018-09-19 03:05:24,justo etiam pretium iaculis justo in hac,set
340,2020-03-25 01:03:55,2020-03-25 23:30:27,platea dictumst morbi vestibulum velit id pretium,cancelled
341,2018-12-27 19:13:31,2018-12-27 16:22:22,a nibh in quis justo maecenas rhoncus,set
342,2019-04-30 13:30:22,2019-04-30 13:55:05,dictumst maecenas ut massa quis augue luctus tincidunt nulla mollis molestie lorem,cancelled
343,2019-08-14 08:31:28,2019-08-14 01:26:21,orci luctus et ultrices posuere cubilia curae mauris viverra diam,set
344,2020-01-24 13:52:16,2020-01-24 00:28:05,tincidunt lacus at velit vivamus vel nulla eget eros elementum,cancelled
345,2018-10-20 02:29:16,2018-10-20 01:19:44,dapibus at diam nam tristique tortor,set
346,2019-09-01 02:11:53,2019-09-01 20:43:49,integer ac neque duis bibendum morbi non,cancelled
347,2020-07-07 19:50:58,2020-07-07 18:46:28,quisque id justo sit amet sapien,set
348,2019-11-20 06:57:51,2019-11-20 22:49:59,vel pede morbi porttitor lorem id ligula suspendisse,set
349,2019-03-19 11:36:55,2019-03-19 19:17:43,pede justo lacinia eget tincidunt eget tempus,set
350,2018-09-26 19:19:56,2018-09-26 17:46:00,sed vestibulum sit amet cursus id turpis integer aliquet massa id,set
351,2019-10-17 22:25:17,2019-10-17 08:59:03,magna ac consequat metus sapien ut,cancelled
352,2018-07-04 12:30:17,2018-07-04 22:26:41,condimentum neque sapien placerat ante nulla justo aliquam quis turpis,set
353,2020-09-01 17:25:12,2020-09-01 02:53:14,dui vel sem sed sagittis nam congue risus semper porta volutpat quam,set
354,2019-01-14 11:17:33,2019-01-14 05:27:04,cursus urna ut tellus nulla ut erat id,set
355,2018-10-26 16:17:56,2018-10-26 02:36:58,in sagittis dui vel nisl duis ac nibh fusce lacus purus,cancelled
356,2018-06-10 12:07:32,2018-06-10 04:49:18,amet lobortis sapien sapien non mi integer ac neque duis,set
357,2020-05-20 13:08:59,2020-05-20 01:41:58,lacus morbi quis tortor id nulla ultrices,cancelled
358,2020-01-18 05:23:48,2020-01-18 05:44:26,porta volutpat quam pede lobortis ligula sit amet eleifend pede libero,set
359,2018-05-21 03:36:17,2018-05-21 09:45:45,ligula in lacus curabitur at ipsum ac tellus semper interdum mauris,cancelled
360,2020-03-01 09:56:23,2020-03-01 22:30:48,quis orci nullam molestie nibh in lectus pellentesque at nulla suspendisse,cancelled
361,2019-10-22 22:29:07,2019-10-22 01:17:27,proin interdum mauris non ligula pellentesque,cancelled
362,2020-01-31 02:20:27,2020-01-31 06:19:02,libero convallis eget eleifend luctus ultricies eu,cancelled
363,2018-12-04 17:11:39,2018-12-04 23:31:25,nulla suscipit ligula in lacus curabitur at ipsum ac,cancelled
364,2020-04-24 10:16:45,2020-04-24 00:16:01,congue elementum in hac habitasse platea,cancelled
365,2020-01-31 02:45:51,2020-01-31 11:27:57,sit amet turpis elementum ligula vehicula consequat morbi a ipsum integer a,set
366,2018-06-16 20:38:18,2018-06-16 05:23:23,accumsan odio curabitur convallis duis consequat dui,cancelled
367,2018-08-22 08:31:53,2018-08-22 15:41:01,condimentum neque sapien placerat ante nulla justo aliquam quis turpis eget,cancelled
368,2019-04-24 17:26:00,2019-04-24 20:52:52,integer aliquet massa id lobortis convallis tortor risus dapibus augue vel,set
369,2018-05-25 02:03:21,2018-05-25 18:11:47,montes nascetur ridiculus mus vivamus vestibulum sagittis sapien cum sociis natoque penatibus,cancelled
370,2018-08-30 13:37:00,2018-08-30 06:05:34,turpis integer aliquet massa id lobortis,set
371,2020-07-07 09:45:34,2020-07-07 18:52:55,ut nulla sed accumsan felis ut,set
372,2019-12-21 17:08:04,2019-12-21 19:56:53,tempor turpis nec euismod scelerisque quam turpis adipiscing lorem vitae mattis nibh,cancelled
373,2020-02-16 15:24:50,2020-02-16 07:10:44,placerat praesent blandit nam nulla integer,set
374,2019-05-22 18:43:44,2019-05-22 13:16:15,at vulputate vitae nisl aenean lectus pellentesque eget nunc donec,cancelled
375,2019-06-30 16:31:49,2019-06-30 10:09:07,ultrices vel augue vestibulum ante ipsum,cancelled
376,2019-09-28 00:42:47,2019-09-28 17:14:48,vestibulum sit amet cursus id turpis integer aliquet massa,cancelled
377,2020-04-12 12:26:16,2020-04-12 16:27:52,vel est donec odio justo sollicitudin ut,set
378,2018-12-30 11:59:48,2018-12-30 21:10:24,tincidunt eget tempus vel pede morbi,cancelled
379,2019-05-23 02:11:22,2019-05-23 20:13:49,pede justo lacinia eget tincidunt eget tempus vel pede morbi,cancelled
380,2020-02-21 05:02:31,2020-02-21 07:17:50,mi sit amet lobortis sapien sapien,cancelled
381,2018-10-04 06:12:04,2018-10-04 22:26:17,lectus pellentesque at nulla suspendisse potenti cras in purus eu magna,set
382,2019-06-29 14:29:42,2019-06-29 08:14:10,in faucibus orci luctus et ultrices posuere cubilia curae donec pharetra,set
383,2018-11-09 07:17:38,2018-11-09 09:27:01,ligula suspendisse ornare consequat lectus in est risus auctor sed tristique,set
384,2018-08-03 07:29:22,2018-08-03 23:16:39,integer a nibh in quis justo maecenas rhoncus aliquam lacus morbi,cancelled
385,2019-05-30 17:46:02,2019-05-30 22:07:18,tincidunt ante vel ipsum praesent blandit lacinia erat vestibulum sed magna at,set
386,2018-11-23 15:42:23,2018-11-23 14:05:32,a ipsum integer a nibh in quis justo maecenas rhoncus,set
387,2018-06-06 14:11:00,2018-06-06 17:12:29,amet diam in magna bibendum imperdiet nullam,cancelled
388,2019-06-22 05:00:34,2019-06-22 01:44:47,pretium iaculis justo in hac habitasse platea dictumst etiam faucibus cursus urna,set
389,2018-10-26 07:14:09,2018-10-26 04:45:01,eu magna vulputate luctus cum sociis natoque penatibus et,cancelled
390,2020-01-05 15:00:00,2020-01-05 06:09:29,vel enim sit amet nunc viverra dapibus nulla suscipit,set
391,2020-03-12 23:00:12,2020-03-12 02:53:54,amet justo morbi ut odio cras mi pede malesuada in,cancelled
392,2019-03-10 00:28:00,2019-03-10 21:42:15,sed justo pellentesque viverra pede ac diam cras pellentesque volutpat,set
393,2020-06-17 07:09:40,2020-06-17 00:05:29,libero nam dui proin leo odio porttitor,set
394,2019-09-02 18:05:09,2019-09-02 07:58:53,rutrum neque aenean auctor gravida sem,set
395,2019-02-11 15:35:10,2019-02-11 19:19:54,suspendisse potenti nullam porttitor lacus at,set
396,2020-03-23 23:42:00,2020-03-23 00:45:19,eu magna vulputate luctus cum sociis natoque,cancelled
397,2018-08-30 09:52:59,2018-08-30 14:34:13,viverra pede ac diam cras pellentesque volutpat dui maecenas tristique est et,cancelled
398,2020-02-24 14:38:01,2020-02-24 10:02:03,luctus tincidunt nulla mollis molestie lorem quisque ut erat curabitur gravida nisi,cancelled
399,2020-02-26 07:56:41,2020-02-26 23:38:56,erat tortor sollicitudin mi sit amet lobortis sapien,set
400,2018-09-17 18:01:52,2018-09-17 15:44:23,eget semper rutrum nulla nunc purus phasellus,cancelled
401,2019-04-30 18:11:35,2019-04-30 12:49:48,viverra eget congue eget semper rutrum nulla nunc purus phasellus in felis,cancelled
402,2019-03-20 12:51:54,2019-03-20 08:25:13,ut ultrices vel augue vestibulum ante ipsum primis in faucibus orci,cancelled
403,2020-08-04 03:26:10,2020-08-04 13:59:00,proin risus praesent lectus vestibulum quam sapien varius,set
404,2018-07-14 16:10:54,2018-07-14 23:41:02,donec posuere metus vitae ipsum aliquam non mauris,set
405,2018-10-16 12:19:40,2018-10-16 09:37:59,consectetuer adipiscing elit proin risus praesent lectus,cancelled
406,2018-07-13 05:25:55,2018-07-13 02:35:46,ut odio cras mi pede malesuada in imperdiet et commodo vulputate justo,cancelled
407,2018-10-26 17:47:14,2018-10-26 03:50:17,arcu sed augue aliquam erat volutpat in,set
408,2019-04-28 09:53:17,2019-04-28 16:21:12,potenti cras in purus eu magna vulputate luctus cum sociis natoque penatibus,set
409,2018-12-04 08:12:53,2018-12-04 03:05:41,erat id mauris vulputate elementum nullam varius nulla,cancelled
410,2019-10-23 21:05:32,2019-10-23 20:35:14,ultrices phasellus id sapien in sapien iaculis congue vivamus,cancelled
411,2020-05-21 05:21:41,2020-05-21 15:56:20,elementum pellentesque quisque porta volutpat erat quisque erat,set
412,2019-04-04 19:16:17,2019-04-04 13:18:43,donec odio justo sollicitudin ut suscipit a feugiat et eros vestibulum ac,set
413,2019-02-27 17:28:18,2019-02-27 22:32:41,proin eu mi nulla ac enim,cancelled
414,2019-04-26 16:03:04,2019-04-26 08:14:29,ante ipsum primis in faucibus orci luctus et,set
415,2018-11-09 20:22:53,2018-11-09 01:26:23,massa donec dapibus duis at velit eu est,cancelled
416,2019-05-05 23:13:26,2019-05-05 01:45:11,tristique fusce congue diam id ornare imperdiet sapien urna,cancelled
417,2019-12-27 00:54:24,2019-12-27 04:02:12,suscipit a feugiat et eros vestibulum ac est lacinia nisi venenatis,cancelled
418,2019-04-16 12:12:18,2019-04-16 13:56:32,augue vestibulum rutrum rutrum neque aenean auctor gravida,cancelled
419,2018-05-23 15:53:28,2018-05-23 03:58:18,amet sapien dignissim vestibulum vestibulum ante ipsum primis,set
420,2020-07-07 18:26:36,2020-07-07 09:42:12,vitae nisi nam ultrices libero non mattis pulvinar nulla pede,cancelled
421,2018-10-07 06:56:14,2018-10-07 15:17:35,vulputate luctus cum sociis natoque penatibus et magnis dis parturient,set
422,2018-06-05 22:13:11,2018-06-05 07:21:55,consectetuer adipiscing elit proin interdum mauris non ligula pellentesque,cancelled
423,2019-12-27 21:01:45,2019-12-27 00:20:48,felis donec semper sapien a libero,set
424,2020-06-29 21:53:43,2020-06-29 06:13:19,ut erat id mauris vulputate elementum nullam varius nulla facilisi cras,cancelled
425,2019-05-12 16:33:44,2019-05-12 10:09:37,in porttitor pede justo eu massa,cancelled
426,2019-02-04 21:01:33,2019-02-04 02:57:42,pretium nisl ut volutpat sapien arcu sed augue aliquam erat volutpat,cancelled
427,2019-04-19 22:49:13,2019-04-19 19:18:35,sapien in sapien iaculis congue vivamus metus arcu,set
428,2019-09-04 09:35:13,2019-09-04 08:13:23,orci pede venenatis non sodales sed tincidunt,set
429,2019-12-08 04:08:09,2019-12-08 09:58:07,quis turpis eget elit sodales scelerisque,cancelled
430,2020-06-28 01:16:54,2020-06-28 08:24:58,vestibulum ante ipsum primis in faucibus orci,cancelled
431,2019-12-07 12:59:48,2019-12-07 02:32:34,duis bibendum felis sed interdum venenatis turpis enim,cancelled
432,2018-06-23 23:28:37,2018-06-23 11:02:22,vestibulum aliquet ultrices erat tortor sollicitudin mi sit amet lobortis sapien,set
433,2020-03-13 02:00:46,2020-03-13 10:45:18,vitae mattis nibh ligula nec sem duis,cancelled
434,2018-09-03 07:17:17,2018-09-03 15:47:47,sit amet eleifend pede libero quis orci nullam molestie nibh in,cancelled
435,2018-10-15 17:58:59,2018-10-15 17:40:43,vestibulum ante ipsum primis in faucibus orci luctus et,set
436,2020-08-11 15:56:33,2020-08-11 08:20:21,aenean fermentum donec ut mauris eget massa tempor convallis nulla neque,cancelled
437,2019-08-25 15:33:15,2019-08-25 13:30:34,dapibus nulla suscipit ligula in lacus curabitur,cancelled
438,2020-06-28 01:17:43,2020-06-28 11:53:23,ligula nec sem duis aliquam convallis nunc proin at turpis,set
439,2019-09-13 12:28:26,2019-09-13 17:31:51,a feugiat et eros vestibulum ac,cancelled
440,2020-07-17 02:23:08,2020-07-17 05:04:15,placerat praesent blandit nam nulla integer pede,set
441,2018-08-22 16:47:18,2018-08-22 17:58:36,dapibus dolor vel est donec odio justo sollicitudin ut suscipit,cancelled
442,2019-08-09 09:28:58,2019-08-09 11:55:21,vel nulla eget eros elementum pellentesque quisque porta volutpat erat quisque erat,cancelled
443,2019-03-11 06:34:14,2019-03-11 03:11:03,vestibulum velit id pretium iaculis diam,cancelled
444,2019-05-21 16:14:47,2019-05-21 06:11:51,orci mauris lacinia sapien quis libero nullam sit amet turpis elementum ligula,set
445,2019-04-05 19:01:05,2019-04-05 20:35:59,cubilia curae duis faucibus accumsan odio curabitur convallis duis consequat,cancelled
446,2018-08-17 12:36:13,2018-08-17 21:41:59,vivamus vel nulla eget eros elementum pellentesque,cancelled
447,2018-09-18 01:39:10,2018-09-18 06:18:54,ac nulla sed vel enim sit amet,set
448,2019-09-29 03:40:24,2019-09-29 09:09:57,curabitur at ipsum ac tellus semper interdum mauris,set
449,2018-11-30 09:08:46,2018-11-30 06:24:48,sapien varius ut blandit non interdum in,cancelled
450,2019-05-03 20:56:03,2019-05-03 21:11:17,et ultrices posuere cubilia curae donec pharetra magna,set
451,2018-10-07 00:43:27,2018-10-07 21:39:49,posuere cubilia curae nulla dapibus dolor vel est,set
452,2019-11-01 15:32:33,2019-11-01 07:39:22,non quam nec dui luctus rutrum nulla tellus in sagittis dui,set
453,2018-08-05 19:59:17,2018-08-05 19:13:15,odio elementum eu interdum eu tincidunt in leo maecenas pulvinar lobortis,cancelled
454,2020-04-20 18:00:18,2020-04-20 09:00:20,leo maecenas pulvinar lobortis est phasellus,set
455,2018-10-21 11:07:05,2018-10-21 03:15:46,ipsum primis in faucibus orci luctus et ultrices posuere cubilia,set
456,2019-06-13 19:29:31,2019-06-13 03:22:06,vestibulum eget vulputate ut ultrices vel,cancelled
457,2020-07-12 11:54:02,2020-07-12 20:01:10,tristique fusce congue diam id ornare imperdiet sapien urna pretium,cancelled
458,2018-11-07 08:42:39,2018-11-07 17:18:31,proin risus praesent lectus vestibulum quam sapien varius,cancelled
459,2019-03-21 03:03:41,2019-03-21 14:14:30,vestibulum vestibulum ante ipsum primis in faucibus orci,cancelled
460,2018-08-09 17:46:54,2018-08-09 10:38:54,urna pretium nisl ut volutpat sapien arcu sed augue,set
461,2018-07-16 13:12:56,2018-07-16 06:24:28,aliquam lacus morbi quis tortor id,cancelled
462,2020-07-30 03:54:41,2020-07-30 12:59:13,praesent id massa id nisl venenatis,set
463,2019-01-09 00:06:08,2019-01-09 01:35:15,metus vitae ipsum aliquam non mauris morbi non,cancelled
464,2019-05-21 10:09:37,2019-05-21 14:04:04,orci eget orci vehicula condimentum curabitur in libero ut,set
465,2019-08-29 19:52:20,2019-08-29 19:39:44,sociis natoque penatibus et magnis dis parturient montes nascetur,cancelled
466,2020-08-27 10:40:50,2020-08-27 02:23:46,sagittis dui vel nisl duis ac nibh fusce lacus purus aliquet,set
467,2019-04-26 21:15:54,2019-04-26 08:43:30,nulla suscipit ligula in lacus curabitur at ipsum ac tellus,set
468,2020-03-23 17:50:56,2020-03-23 17:13:17,semper interdum mauris ullamcorper purus sit amet nulla quisque arcu libero rutrum,cancelled
469,2019-03-13 23:27:13,2019-03-13 08:27:42,ligula suspendisse ornare consequat lectus in est risus,set
470,2019-08-13 02:19:24,2019-08-13 02:32:33,montes nascetur ridiculus mus vivamus vestibulum sagittis sapien cum sociis natoque,set
471,2020-05-16 13:28:13,2020-05-16 03:06:28,sed ante vivamus tortor duis mattis egestas metus aenean fermentum donec ut,cancelled
472,2019-01-11 19:28:55,2019-01-11 08:51:09,sapien iaculis congue vivamus metus arcu adipiscing molestie,cancelled
473,2020-04-28 11:35:04,2020-04-28 02:23:26,integer ac leo pellentesque ultrices mattis odio donec vitae,set
474,2019-10-24 01:55:44,2019-10-24 04:18:15,dui proin leo odio porttitor id consequat in consequat,set
475,2019-09-27 17:54:06,2019-09-27 14:20:11,consectetuer eget rutrum at lorem integer tincidunt ante vel ipsum praesent,cancelled
476,2019-01-05 08:20:02,2019-01-05 21:41:09,id consequat in consequat ut nulla sed,set
