appointmentId,startDateAndTime,endDateAndTime,remarks,status
477,2019-03-31 22:19:55,2019-03-31 20:57:30,cras pellentesque volutpat dui maecenas tristique est et tempus semper,set
478,2020-06-21 01:04:52,2020-06-21 02:36:34,elementum in hac habitasse platea dictumst morbi vestibulum velit id pretium iaculis,set
479,2019-02-07 15:07:27,2019-02-07 11:58:18,proin leo odio porttitor id consequat in consequat ut nulla,cancelled
480,2020-03-21 22:51:29,2020-03-21 10:17:07,ultrices aliquet maecenas leo odio condimentum id luctus,cancelled
481,2019-12-29 05:45:20,2019-12-29 18:42:01,est risus auctor sed tristique in tempus sit,set
482,2019-04-22 04:03:29,2019-04-22 19:23:26,maecenas tristique est et tempus semper est quam pharetra magna ac consequat,set
483,2019-12-25 03:46:41,2019-12-25 15:59:21,vestibulum velit id pretium iaculis diam erat,set
484,2020-07-08 14:17:56,2020-07-08 10:41:23,eleifend luctus ultricies eu nibh quisque,cancelled
485,2019-12-10 21:29:37,2019-12-10 21:50:36,accumsan tortor quis turpis sed ante vivamus tortor duis mattis egestas,set
486,2019-11-05 15:31:49,2019-11-05 00:03:03,eget vulputate ut ultrices vel augue vestibulum ante,cancelled
487,2019-03-30 21:49:13,2019-03-30 17:49:01,dui nec nisi volutpat eleifend donec ut dolor morbi vel,cancelled
488,2020-02-20 03:40:33,2020-02-20 17:13:06,elementum pellentesque quisque porta volutpat erat quisque erat eros viverra eget congue,set
489,2018-09-03 06:11:50,2018-09-03 06:59:21,eget rutrum at lorem integer tincidunt ante,set
490,2018-07-24 22:46:10,2018-07-24 11:19:49,ut nulla sed accumsan felis ut at,cancelled
491,2020-01-03 07:57:50,2020-01-03 16:11:30,integer a nibh in quis justo maecenas rhoncus aliquam,cancelled
492,2018-05-25 11:22:34,2018-05-25 00:47:48,orci luctus et ultrices posuere cubilia curae nulla dapibus dolor,set
493,2020-06-08 21:53:16,2020-06-08 10:38:02,dapibus nulla suscipit ligula in lacus curabitur at,set
494,2018-07-25 20:35:37,2018-07-25 06:56:53,iaculis diam erat fermentum justo nec condimentum,cancelled
495,2019-08-28 16:22:15,2019-08-28 05:56:22,orci mauris lacinia sapien quis libero nullam,set
496,2018-05-23 05:48:43,2018-05-23 03:58:16,quis lectus suspendisse potenti in eleifend quam a,cancelled
497,2018-05-28 02:50:06,2018-05-28 09:11:02,ut massa quis augue luctus tincidunt nulla,set
498,2019-03-08 13:08:18,2019-03-08 06:50:45,morbi a ipsum integer a nibh in,cancelled
499,2020-02-09 08:42:12,2020-02-09 05:21:09,aenean auctor gravida sem praesent id massa id nisl venenatis lacinia aenean,cancelled
500,2018-10-04 05:36:01,2018-10-04 01:21:37,proin risus praesent lectus vestibulum quam,set
501,2019-04-03 02:40:09,2019-04-03 00:09:12,quisque erat eros viverra eget congue,set
502,2019-10-09 17:50:26,2019-10-09 06:27:15,duis at velit eu est congue elementum in hac habitasse platea,set
503,2018-10-22 17:22:11,2018-10-22 13:57:25,urna pretium nisl ut volutpat sapien,set
504,2019-04-30 15:14:58,2019-04-30 11:17:53,cum sociis natoque penatibus et magnis dis parturient montes nascetur ridiculus,set
505,2019-03-22 01:18:05,2019-03-22 22:57:50,amet nunc viverra dapibus nulla suscipit ligula in lacus curabitur at,cancelled
506,2019-02-17 04:23:16,2019-02-17 04:07:14,consequat ut nulla sed accumsan felis ut at dolor,set
507,2019-04-14 00:58:25,2019-04-14 08:51:39,neque duis bibendum morbi non quam nec,cancelled
508,2018-06-14 18:05:47,2018-06-14 23:18:18,quis lectus suspendisse potenti in eleifend quam a odio,set
509,2019-02-02 06:11:35,2019-02-02 03:45:57,posuere cubilia curae nulla dapibus dolor vel est donec,set
510,2019-02-02 12:57:35,2019-02-02 14:20:40,venenatis turpis enim blandit mi in porttitor pede justo eu,set
511,2020-02-20 04:25:30,2020-02-20 21:41:54,habitasse platea dictumst aliquam augue quam,cancelled
512,2019-12-15 03:10:06,2019-12-15 03:42:24,sagittis dui vel nisl duis ac,cancelled
513,2018-12-30 11:25:56,2018-12-30 18:12:16,odio condimentum id luctus nec molestie sed justo pellentesque viverra pede,cancelled
514,2018-08-09 14:42:47,2018-08-09 10:43:22,sit amet sapien dignissim vestibulum vestibulum ante ipsum,set
515,2020-02-12 03:09:08,2020-02-12 11:17:59,duis ac nibh fusce lacus purus,set
516,2018-10-19 17:25:00,2018-10-19 10:50:34,congue etiam justo etiam pretium iaculis justo in hac habitasse platea,set
517,2018-11-15 00:20:05,2018-11-15 03:43:01,nec molestie sed justo pellentesque viverra pede ac diam cras pellentesque volutpat,set
518,2020-02-09 14:14:52,2020-02-09 01:00:49,nisi eu orci mauris lacinia sapien quis libero nullam sit amet turpis,cancelled
519,2019-12-11 16:51:25,2019-12-11 11:58:48,ligula nec sem duis aliquam convallis,cancelled
520,2019-07-03 02:39:51,2019-07-03 20:24:04,faucibus orci luctus et ultrices posuere cubilia curae mauris,cancelled
521,2020-05-17 16:47:53,2020-05-17 15:42:40,nec dui luctus rutrum nulla tellus,set
522,2019-12-21 19:12:23,2019-12-21 22:02:36,ullamcorper augue a suscipit nulla elit ac nulla sed vel,set
523,2019-10-09 19:58:16,2019-10-09 08:38:28,vestibulum rutrum rutrum neque aenean auctor gravida sem praesent id massa,set
524,2019-05-26 02:33:28,2019-05-26 21:20:50,nulla eget eros elementum pellentesque quisque porta volutpat erat quisque erat eros,set
525,2019-06-14 23:54:11,2019-06-14 22:27:55,vehicula consequat morbi a ipsum integer a nibh in quis justo,set
526,2018-12-30 03:34:45,2018-12-30 05:21:54,in lacus curabitur at ipsum ac tellus semper interdum mauris ullamcorper purus,cancelled
527,2020-06-26 06:24:02,2020-06-26 15:26:37,elit ac nulla sed vel enim sit amet nunc viverra dapibus nulla,cancelled
528,2018-10-07 15:35:22,2018-10-07 03:49:32,mattis odio donec vitae nisi nam ultrices libero non mattis,cancelled
529,2019-05-18 16:19:26,2019-05-18 10:57:44,tempus semper est quam pharetra magna ac consequat metus sapien ut nunc,cancelled
530,2019-06-24 19:31:33,2019-06-24 14:53:30,a pede posuere nonummy integer non,set
531,2019-03-20 23:26:16,2019-03-20 09:51:06,ac leo pellentesque ultrices mattis odio donec vitae nisi,set
532,2019-01-01 06:24:36,2019-01-01 06:01:26,et ultrices posuere cubilia curae duis faucibus,cancelled
533,2020-01-01 11:56:47,2020-01-01 11:19:37,ut odio cras mi pede malesuada in imperdiet et,cancelled
534,2019-11-27 03:38:41,2019-11-27 13:39:20,curae nulla dapibus dolor vel est donec odio justo sollicitudin ut suscipit,set
535,2020-08-02 18:13:07,2020-08-02 16:16:58,felis fusce posuere felis sed lacus morbi sem mauris laoreet ut,set
536,2019-04-25 21:10:11,2019-04-25 20:33:43,habitasse platea dictumst etiam faucibus cursus urna,cancelled
537,2019-03-26 04:44:35,2019-03-26 18:33:06,mattis pulvinar nulla pede ullamcorper augue a suscipit nulla elit ac,set
538,2019-08-08 21:10:33,2019-08-08 20:10:46,odio in hac habitasse platea dictumst maecenas ut massa,set
539,2019-01-01 06:43:35,2019-01-01 21:16:30,justo sit amet sapien dignissim vestibulum vestibulum ante ipsum primis in faucibus,cancelled
540,2020-02-04 03:52:26,2020-02-04 10:17:18,mollis molestie lorem quisque ut erat curabitur gravida,cancelled
541,2018-09-29 16:12:32,2018-09-29 18:55:21,pellentesque eget nunc donec quis orci eget orci vehicula condimentum curabitur in,cancelled
542,2018-07-09 15:53:26,2018-07-09 11:00:02,metus vitae ipsum aliquam non mauris morbi non lectus aliquam,cancelled
543,2019-03-28 05:47:26,2019-03-28 15:24:10,turpis integer aliquet massa id lobortis,cancelled
544,2020-02-26 11:24:11,2020-02-26 19:18:29,donec posuere metus vitae ipsum aliquam non mauris morbi,cancelled
545,2018-10-23 00:34:15,2018-10-23 01:22:10,sem fusce consequat nulla nisl nunc nisl duis bibendum felis sed,set
546,2018-08-11 06:14:28,2018-08-11 05:08:51,magna vulputate luctus cum sociis natoque penatibus et magnis,set
547,2019-05-17 02:47:05,2019-05-17 20:46:49,lacus curabitur at ipsum ac tellus semper interdum,set
548,2018-08-30 19:29:41,2018-08-30 22:31:34,congue etiam justo etiam pretium iaculis,cancelled
549,2018-10-04 00:11:37,2018-10-04 07:18:22,rhoncus aliquet pulvinar sed nisl nunc rhoncus dui,set
550,2019-05-29 03:35:43,2019-05-29 13:03:18,in hac habitasse platea dictumst morbi vestibulum velit id pretium iaculis diam,set
551,2018-07-21 03:21:35,2018-07-21 22:48:06,leo maecenas pulvinar lobortis est phasellus sit amet erat nulla,set
552,2018-07-18 11:17:27,2018-07-18 11:53:32,ipsum primis in faucibus orci luctus et ultrices posuere cubilia curae mauris,cancelled
553,2019-05-17 09:59:04,2019-05-17 23:42:23,enim leo rhoncus sed vestibulum sit amet,cancelled
554,2019-08-14 12:52:09,2019-08-14 00:58:34,interdum mauris non ligula pellentesque ultrices phasellus id sapien in sapien,set
555,2018-09-06 00:44:05,2018-09-06 08:12:13,ut odio cras mi pede malesuada in,cancelled
556,2019-12-05 23:18:22,2019-12-05 11:07:54,a nibh in quis justo maecenas rhoncus aliquam,set
557,2018-10-24 19:31:08,2018-10-24 06:55:20,pretium iaculis diam erat fermentum justo nec condimentum neque sapien placerat,cancelled
558,2019-08-02 21:26:05,2019-08-02 23:16:02,ipsum primis in faucibus orci luctus et ultrices posuere cubilia,cancelled
559,2019-09-07 19:28:22,2019-09-07 16:11:25,nunc nisl duis bibendum felis sed interdum venenatis,cancelled
560,2019-04-11 18:44:03,2019-04-11 21:56:55,luctus et ultrices posuere cubilia curae donec pharetra magna,cancelled
561,2019-01-25 00:40:48,2019-01-25 18:54:35,justo in hac habitasse platea dictumst etiam faucibus cursus,cancelled
562,2019-04-03 15:12:12,2019-04-03 12:33:43,euismod scelerisque quam turpis adipiscing lorem vitae mattis nibh,cancelled
563,2018-08-17 00:04:18,2018-08-17 21:00:25,velit eu est congue elementum in hac,cancelled
564,2020-04-25 13:11:04,2020-04-25 02:12:23,justo sit amet sapien dignissim vestibulum vestibulum ante ipsum,cancelled
565,2019-11-03 11:52:24,2019-11-03 00:54:01,accumsan tortor quis turpis sed ante vivamus tortor duis,set
566,2020-07-05 13:26:09,2020-07-05 08:07:41,augue luctus tincidunt nulla mollis molestie lorem quisque ut,cancelled
567,2020-08-19 21:18:26,2020-08-19 03:05:56,orci luctus et ultrices posuere cubilia,cancelled
568,2020-08-13 14:26:02,2020-08-13 19:00:59,aliquet pulvinar sed nisl nunc rhoncus dui vel sem sed,set
569,2019-05-08 22:14:18,2019-05-08 23:50:18,posuere cubilia curae mauris viverra diam vitae quam suspendisse potenti nullam,cancelled
570,2019-11-10 07:38:03,2019-11-10 01:54:23,elit proin interdum mauris non ligula pellentesque ultrices phasellus id sapien in,cancelled
571,2020-06-08 20:21:54,2020-06-08 13:16:55,consequat morbi a ipsum integer a nibh in quis justo maecenas rhoncus,cancelled
572,2019-04-12 04:28:15,2019-04-12 15:12:13,etiam justo etiam pretium iaculis justo in,cancelled
573,2018-11-04 06:13:53,2018-11-04 03:14:12,leo pellentesque ultrices mattis odio donec vitae nisi nam,set
574,2019-09-12 16:06:53,2019-09-12 10:44:49,est phasellus sit amet erat nulla tempus vivamus in felis eu,cancelled
575,2019-04-09 01:04:28,2019-04-09 08:58:07,aenean auctor gravida sem praesent id massa id nisl venenatis lacinia,cancelled
576,2019-03-24 19:15:02,2019-03-24 12:13:11,nulla tellus in sagittis dui vel,cancelled
577,2019-04-07 12:01:28,2019-04-07 02:12:02,nascetur ridiculus mus etiam vel augue,set
578,2019-11-06 02:21:47,2019-11-06 13:34:51,sit amet turpis elementum ligula vehicula,set
579,2020-07-04 13:44:58,2020-07-04 19:31:19,sed augue aliquam erat volutpat in congue etiam justo etiam pretium,cancelled
580,2020-09-09 13:42:03,2020-09-09 14:03:20,amet eros suspendisse accumsan tortor quis turpis sed ante vivamus,cancelled
581,2020-08-26 06:27:53,2020-08-26 21:03:06,cursus id turpis integer aliquet massa,set
582,2018-09-06 21:23:03,2018-09-06 15:15:33,eget orci vehicula condimentum curabitur in libero ut massa volutpat convallis morbi,cancelled
583,2019-07-26 05:09:57,2019-07-26 18:42:43,nunc vestibulum ante ipsum primis in faucibus orci luctus et,cancelled
584,2018-07-13 03:52:17,2018-07-13 19:39:03,vehicula condimentum curabitur in libero ut massa volutpat convallis,cancelled
585,2020-02-04 13:06:29,2020-02-04 12:20:05,nulla facilisi cras non velit nec nisi,cancelled
586,2020-02-06 06:35:14,2020-02-06 15:24:54,vulputate elementum nullam varius nulla facilisi cras non velit nec nisi,cancelled
587,2019-07-11 19:48:43,2019-07-11 12:42:08,congue diam id ornare imperdiet sapien urna pretium nisl,cancelled
588,2019-03-30 01:45:01,2019-03-30 10:36:59,nibh in quis justo maecenas rhoncus aliquam lacus,set
589,2019-05-07 21:53:42,2019-05-07 13:25:17,ut blandit non interdum in ante vestibulum ante ipsum primis in faucibus,set
590,2018-08-12 18:51:40,2018-08-12 06:01:59,suscipit ligula in lacus curabitur at ipsum ac tellus semper interdum mauris,cancelled
591,2019-09-08 06:42:50,2019-09-08 18:03:18,in quis justo maecenas rhoncus aliquam lacus morbi quis tortor id,set
592,2020-07-27 21:04:50,2020-07-27 19:40:42,quam fringilla rhoncus mauris enim leo rhoncus,cancelled
593,2018-10-04 09:07:40,2018-10-04 07:54:37,donec vitae nisi nam ultrices libero non mattis pulvinar nulla,set
594,2018-06-15 05:24:13,2018-06-15 09:46:47,cursus vestibulum proin eu mi nulla ac,set
595,2019-11-22 11:26:41,2019-11-22 04:06:53,potenti in eleifend quam a odio in hac,set
596,2018-12-17 16:30:58,2018-12-17 03:53:46,sit amet diam in magna bibendum imperdiet nullam orci pede,set
597,2018-08-21 01:10:22,2018-08-21 02:50:58,vel augue vestibulum rutrum rutrum neque aenean auctor gravida sem praesent,set
598,2018-09-13 03:05:31,2018-09-13 14:16:26,in faucibus orci luctus et ultrices posuere cubilia curae donec,cancelled
599,2020-04-27 15:19:42,2020-04-27 03:34:44,ultrices mattis odio donec vitae nisi,set
600,2019-03-18 18:49:45,2019-03-18 07:11:33,eget tincidunt eget tempus vel pede morbi porttitor,cancelled
601,2019-09-29 00:00:33,2019-09-29 18:22:12,nullam porttitor lacus at turpis donec,set
602,2020-02-10 19:53:23,2020-02-10 22:46:29,tincidunt eget tempus vel pede morbi porttitor lorem,cancelled
603,2019-05-21 16:42:23,2019-05-21 15:29:53,vel sem sed sagittis nam congue risus semper porta,set
604,2020-01-01 08:51:24,2020-01-01 00:27:03,non mauris morbi non lectus aliquam,cancelled
605,2018-12-07 23:17:14,2018-12-07 13:35:30,lorem vitae mattis nibh ligula nec sem duis aliquam convallis nunc,cancelled
606,2019-08-08 00:59:31,2019-08-08 19:21:32,odio porttitor id consequat in consequat ut,cancelled
607,2019-02-26 11:12:34,2019-02-26 13:23:25,fermentum donec ut mauris eget massa tempor convallis nulla neque libero convallis,cancelled
608,2020-08-27 08:07:11,2020-08-27 15:17:09,orci vehicula condimentum curabitur in libero ut massa volutpat convallis morbi,set
609,2019-08-22 08:18:39,2019-08-22 04:44:53,scelerisque quam turpis adipiscing lorem vitae mattis nibh ligula nec sem,set
610,2018-11-20 20:00:31,2018-11-20 23:23:33,lectus pellentesque eget nunc donec quis orci eget orci vehicula condimentum curabitur,cancelled
611,2019-12-07 00:31:39,2019-12-07 14:56:32,maecenas ut massa quis augue luctus tincidunt nulla mollis molestie lorem,cancelled
612,2019-07-16 20:11:55,2019-07-16 17:37:26,nisi nam ultrices libero non mattis pulvinar nulla pede,cancelled
613,2019-03-01 18:27:47,2019-03-01 00:56:59,ac leo pellentesque ultrices mattis odio donec vitae nisi,cancelled
614,2019-03-21 12:08:03,2019-03-21 13:27:41,at nibh in hac habitasse platea dictumst,cancelled
615,2019-09-21 08:31:02,2019-09-21 01:02:50,sed tincidunt eu felis fusce posuere felis sed lacus,cancelled
616,2019-03-02 10:05:18,2019-03-02 12:08:18,mauris vulputate elementum nullam varius nulla facilisi cras non,cancelled
617,2019-07-18 18:47:12,2019-07-18 21:24:38,non pretium quis lectus suspendisse potenti in eleifend,cancelled
618,2018-10-10 00:30:36,2018-10-10 00:10:04,amet consectetuer adipiscing elit proin risus praesent lectus vestibulum quam sapien varius,cancelled
619,2019-06-01 05:29:15,2019-06-01 10:16:06,vestibulum sed magna at nunc commodo placerat praesent,cancelled
620,2020-09-02 01:09:44,2020-09-02 16:43:06,risus praesent lectus vestibulum quam sapien varius ut blandit non interdum in,cancelled
621,2020-04-18 11:50:39,2020-04-18 12:15:53,morbi vestibulum velit id pretium iaculis diam erat fermentum justo nec,set
622,2020-07-29 17:33:05,2020-07-29 21:50:06,varius nulla facilisi cras non velit nec nisi vulputate nonummy,set
623,2019-09-01 12:24:04,2019-09-01 06:56:47,vehicula consequat morbi a ipsum integer,cancelled
624,2019-02-04 09:45:01,2019-02-04 10:50:44,faucibus cursus urna ut tellus nulla ut erat id mauris vulputate elementum,cancelled
625,2020-06-04 23:16:04,2020-06-04 00:30:01,donec vitae nisi nam ultrices libero non,cancelled
626,2020-05-27 12:09:34,2020-05-27 03:04:12,odio odio elementum eu interdum eu tincidunt in leo,cancelled
627,2019-05-02 09:04:11,2019-05-02 18:05:33,rhoncus mauris enim leo rhoncus sed vestibulum sit amet cursus id,cancelled
628,2019-08-08 15:51:09,2019-08-08 10:04:16,lectus aliquam sit amet diam in magna bibendum imperdiet nullam orci,cancelled
629,2018-05-15 21:51:18,2018-05-15 01:44:19,dapibus nulla suscipit ligula in lacus curabitur at ipsum ac tellus semper,cancelled
630,2020-01-23 15:48:45,2020-01-23 12:01:18,congue etiam justo etiam pretium iaculis justo,set
631,2018-05-31 17:33:16,2018-05-31 06:41:36,vel accumsan tellus nisi eu orci mauris lacinia sapien,set
632,2019-09-08 18:45:05,2019-09-08 23:23:11,dui vel nisl duis ac nibh fusce lacus,cancelled
633,2018-11-12 05:42:47,2018-11-12 06:41:05,maecenas ut massa quis augue luctus tincidunt nulla mollis molestie lorem,set
634,2019-12-08 04:43:37,2019-12-08 02:39:44,nunc donec quis orci eget orci,cancelled
635,2018-11-16 08:51:31,2018-11-16 15:55:08,pede lobortis ligula sit amet eleifend pede libero quis orci nullam molestie,set
636,2020-07-29 04:30:22,2020-07-29 12:38:52,orci nullam molestie nibh in lectus,cancelled
637,2020-03-16 21:25:00,2020-03-16 02:06:06,augue vestibulum rutrum rutrum neque aenean auctor,cancelled
638,2019-06-14 19:15:03,2019-06-14 11:50:57,habitasse platea dictumst maecenas ut massa quis augue,set
639,2019-05-06 09:25:48,2019-05-06 06:21:24,ultricies eu nibh quisque id justo sit amet sapien dignissim vestibulum vestibulum,cancelled
640,2020-03-07 02:44:55,2020-03-07 13:02:37,in hac habitasse platea dictumst morbi vestibulum,cancelled
641,2018-07-12 21:11:21,2018-07-12 07:52:41,convallis morbi odio odio elementum eu interdum eu tincidunt in,set
642,2020-02-16 04:31:43,2020-02-16 21:01:21,quam turpis adipiscing lorem vitae mattis nibh ligula nec,cancelled
643,2019-05-22 06:25:08,2019-05-22 16:26:20,malesuada in imperdiet et commodo vulputate,set
644,2018-10-18 03:40:20,2018-10-18 11:44:25,vel enim sit amet nunc viverra dapibus nulla suscipit ligula,cancelled
645,2019-03-28 20:26:47,2019-03-28 02:42:18,luctus cum sociis natoque penatibus et magnis dis parturient montes nascetur,set
646,2018-12-17 00:28:12,2018-12-17 15:04:59,in porttitor pede justo eu massa,set
647,2019-07-25 18:20:34,2019-07-25 13:01:41,volutpat dui maecenas tristique est et tempus semper est quam pharetra,cancelled
648,2018-10-22 04:19:36,2018-10-22 01:43:35,elit sodales scelerisque mauris sit amet eros,set
649,2019-03-08 06:02:19,2019-03-08 11:46:32,dolor morbi vel lectus in quam fringilla rhoncus mauris enim leo,cancelled
650,2020-06-09 11:14:21,2020-06-09 02:16:47,id ornare imperdiet sapien urna pretium nisl ut volutpat sapien,cancelled
651,2020-09-12 08:22:55,2020-09-12 12:34:05,accumsan tellus nisi eu orci mauris lacinia sapien quis,cancelled
652,2019-09-18 21:48:47,2019-09-18 11:51:04,donec semper sapien a libero nam dui,cancelled
653,2018-09-07 05:16:47,2018-09-07 04:10:32,hac habitasse platea dictumst etiam faucibus cursus urna ut,set
654,2018-12-02 20:18:51,2018-12-02 11:46:05,praesent blandit lacinia erat vestibulum sed magna at,cancelled
655,2019-12-08 23:16:03,2019-12-08 13:52:47,in consequat ut nulla sed accumsan felis ut at,set
656,2018-12-30 11:26:24,2018-12-30 08:35:44,ultrices libero non mattis pulvinar nulla,set
657,2020-08-11 19:58:04,2020-08-11 06:10:48,at turpis a pede posuere nonummy integer non velit donec,cancelled
658,2020-01-22 18:58:18,2020-01-22 01:34:12,nam congue risus semper porta volutpat quam pede,set
659,2019-06-15 09:40:11,2019-06-15 03:07:53,nisl duis bibendum felis sed interdum venenatis turpis enim blandit mi,cancelled
660,2020-04-21 16:21:11,2020-04-21 06:34:21,pellentesque volutpat dui maecenas tristique est et tempus semper,cancelled
661,2019-06-10 20:25:47,2019-06-10 20:10:57,suspendisse ornare consequat lectus in est risus auctor sed tristique in,set
662,2019-11-23 16:28:13,2019-11-23 23:21:24,convallis eget eleifend luctus ultricies eu nibh quisque id justo,set
663,2019-03-20 19:31:27,2019-03-20 23:39:46,at lorem integer tincidunt ante vel ipsum,cancelled
664,2019-07-19 08:43:58,2019-07-19 07:04:43,ac est lacinia nisi venenatis tristique fusce congue diam,set
665,2020-01-06 22:45:43,2020-01-06 08:51:24,in faucibus orci luctus et ultrices posuere cubilia,set
666,2019-07-12 14:32:33,2019-07-12 11:30:41,pellentesque viverra pede ac diam cras pellentesque volutpat,cancelled
667,2019-08-13 12:54:11,2019-08-13 14:18:45,ac diam cras pellentesque volutpat dui maecenas,set
668,2018-12-04 03:16:08,2018-12-04 20:02:59,ante ipsum primis in faucibus orci luctus,cancelled
669,2018-06-11 09:18:55,2018-06-11 02:34:48,congue diam id ornare imperdiet sapien urna pretium nisl ut,set
670,2020-01-03 17:16:14,2020-01-03 16:05:55,sit amet nulla quisque arcu libero rutrum ac,cancelled
671,2020-02-29 22:50:42,2020-02-29 05:27:10,lobortis sapien sapien non mi integer ac neque duis bibendum,cancelled
672,2019-10-23 07:07:35,2019-10-23 20:02:08,amet justo morbi ut odio cras mi pede malesuada,cancelled
673,2018-07-31 00:43:32,2018-07-31 05:41:02,libero non mattis pulvinar nulla pede ullamcorper augue,cancelled
674,2019-02-20 03:37:54,2019-02-20 22:31:09,elementum eu interdum eu tincidunt in leo,cancelled
675,2019-03-02 00:38:21,2019-03-02 04:06:24,a nibh in quis justo maecenas rhoncus aliquam lacus morbi quis,set
676,2019-05-27 15:32:46,2019-05-27 00:40:50,lectus pellentesque at nulla suspendisse potenti cras in purus eu magna vulputate,cancelled
677,2019-03-12 21:51:45,2019-03-12 23:58:55,pharetra magna ac consequat metus sapien ut nunc vestibulum ante,cancelled
678,2019-06-27 11:44:56,2019-06-27 02:43:35,accumsan tortor quis turpis sed ante vivamus,cancelled
679,2018-08-11 03:13:25,2018-08-11 16:10:22,tempus vel pede morbi porttitor lorem id ligula suspendisse ornare consequat,set
680,2018-10-27 21:55:33,2018-10-27 21:39:49,augue vestibulum ante ipsum primis in,cancelled
681,2019-03-21 03:02:58,2019-03-21 01:29:30,turpis donec posuere metus vitae ipsum aliquam non mauris morbi,cancelled
682,2019-02-21 21:58:14,2019-02-21 15:26:45,leo pellentesque ultrices mattis odio donec vitae nisi nam ultrices libero,cancelled
683,2018-09-23 14:54:39,2018-09-23 16:31:47,eu sapien cursus vestibulum proin eu mi,cancelled
684,2018-06-23 18:16:16,2018-06-23 22:18:42,lacinia eget tincidunt eget tempus vel pede morbi porttitor lorem id ligula,set
685,2019-08-26 06:18:39,2019-08-26 05:05:51,vestibulum ac est lacinia nisi venenatis tristique fusce congue diam id,cancelled
686,2019-01-22 12:40:30,2019-01-22 15:13:11,natoque penatibus et magnis dis parturient,set
687,2018-08-29 22:12:23,2018-08-29 12:24:11,ipsum primis in faucibus orci luctus et ultrices posuere cubilia,cancelled
688,2019-05-05 10:52:29,2019-05-05 15:48:43,ultrices posuere cubilia curae mauris viverra diam vitae quam suspendisse potenti nullam,cancelled
689,2018-05-26 07:30:59,2018-05-26 22:21:17,interdum in ante vestibulum ante ipsum primis in faucibus orci luctus,set
690,2019-06-14 06:22:23,2019-06-14 23:53:20,sem fusce consequat nulla nisl nunc nisl duis bibendum felis,set
691,2020-08-03 19:15:40,2020-08-03 23:55:08,blandit ultrices enim lorem ipsum dolor,set
692,2018-06-08 06:44:28,2018-06-08 16:01:02,quisque id justo sit amet sapien dignissim,set
693,2018-10-17 08:45:34,2018-10-17 14:43:02,sapien non mi integer ac neque duis bibendum morbi non quam,set
694,2019-01-11 21:08:55,2019-01-11 09:36:17,sapien ut nunc vestibulum ante ipsum,cancelled
695,2019-01-25 16:29:44,2019-01-25 17:04:41,pede ullamcorper augue a suscipit nulla elit ac nulla sed,set
696,2020-01-26 10:22:08,2020-01-26 15:05:57,tristique in tempus sit amet sem fusce consequat nulla nisl nunc nisl,cancelled
697,2019-12-25 14:32:50,2019-12-25 14:15:52,nulla ac enim in tempor turpis nec euismod scelerisque quam turpis,set
698,2019-06-04 19:26:44,2019-06-04 17:32:24,interdum venenatis turpis enim blandit mi in,cancelled
699,2019-04-06 16:07:25,2019-04-06 23:01:01,integer tincidunt ante vel ipsum praesent blandit,cancelled
700,2018-08-01 18:47:07,2018-08-01 01:19:07,a ipsum integer a nibh in quis justo maecenas,set
701,2019-05-27 21:43:34,2019-05-27 09:52:41,luctus nec molestie sed justo pellentesque viverra pede ac diam,cancelled
702,2019-08-13 03:59:02,2019-08-13 12:59:38,natoque penatibus et magnis dis parturient montes nascetur ridiculus mus vivamus,cancelled
703,2020-06-14 02:40:18,2020-06-14 23:49:05,quisque erat eros viverra eget congue eget semper,set
704,2020-03-02 00:13:36,2020-03-02 01:57:51,donec diam neque vestibulum eget vulputate ut ultrices vel augue,cancelled
705,2018-12-20 02:45:40,2018-12-20 17:24:02,curabitur convallis duis consequat dui nec nisi volutpat eleifend,set
706,2019-09-08 04:11:40,2019-09-08 09:32:17,nisl aenean lectus pellentesque eget nunc donec quis,set
707,2020-08-16 10:47:23,2020-08-16 00:43:39,dis parturient montes nascetur ridiculus mus vivamus vestibulum sagittis sapien cum sociis,cancelled
708,2020-01-28 19:15:23,2020-01-28 10:57:47,dolor quis odio consequat varius integer ac,cancelled
709,2020-09-08 03:32:00,2020-09-08 07:40:06,sapien dignissim vestibulum vestibulum ante ipsum,cancelled
710,2019-10-10 14:56:13,2019-10-10 17:42:44,in purus eu magna vulputate luctus cum sociis natoque penatibus,cancelled
711,2018-10-21 05:39:42,2018-10-21 12:52:13,mattis pulvinar nulla pede ullamcorper augue a suscipit nulla elit ac,cancelled
712,2019-08-20 09:49:53,2019-08-20 09:44:52,dapibus nulla suscipit ligula in lacus curabitur at ipsum ac,set
